/*M!999999\- enable the sandbox mode */ 
-- MariaDB dump 10.19  Distrib 10.11.14-MariaDB, for debian-linux-gnu (x86_64)
--
-- Host: localhost    Database: avo_zaze
-- ------------------------------------------------------
-- Server version	10.11.14-MariaDB-0+deb12u2

/*!40101 SET @OLD_CHARACTER_SET_CLIENT=@@CHARACTER_SET_CLIENT */;
/*!40101 SET @OLD_CHARACTER_SET_RESULTS=@@CHARACTER_SET_RESULTS */;
/*!40101 SET @OLD_COLLATION_CONNECTION=@@COLLATION_CONNECTION */;
/*!40101 SET NAMES utf8mb4 */;
/*!40103 SET @OLD_TIME_ZONE=@@TIME_ZONE */;
/*!40103 SET TIME_ZONE='+00:00' */;
/*!40014 SET @OLD_UNIQUE_CHECKS=@@UNIQUE_CHECKS, UNIQUE_CHECKS=0 */;
/*!40014 SET @OLD_FOREIGN_KEY_CHECKS=@@FOREIGN_KEY_CHECKS, FOREIGN_KEY_CHECKS=0 */;
/*!40101 SET @OLD_SQL_MODE=@@SQL_MODE, SQL_MODE='NO_AUTO_VALUE_ON_ZERO' */;
/*!40111 SET @OLD_SQL_NOTES=@@SQL_NOTES, SQL_NOTES=0 */;

--
-- Table structure for table `artists`
--

DROP TABLE IF EXISTS `artists`;
/*!40101 SET @saved_cs_client     = @@character_set_client */;
/*!40101 SET character_set_client = utf8mb4 */;
CREATE TABLE `artists` (
  `artist_id` int(11) NOT NULL AUTO_INCREMENT,
  `first_name` varchar(100) NOT NULL,
  `last_name` varchar(100) NOT NULL,
  `type` enum('artist','conductor','pianist','other','group') NOT NULL DEFAULT 'artist',
  `vk_link` varchar(255) DEFAULT NULL,
  `created_at` timestamp NULL DEFAULT current_timestamp(),
  `updated_at` timestamp NULL DEFAULT current_timestamp() ON UPDATE current_timestamp(),
  PRIMARY KEY (`artist_id`),
  UNIQUE KEY `idx_unique_artist_name_type` (`first_name`,`last_name`,`type`)
) ENGINE=InnoDB AUTO_INCREMENT=195 DEFAULT CHARSET=utf8mb4 COLLATE=utf8mb4_general_ci;
/*!40101 SET character_set_client = @saved_cs_client */;

--
-- Dumping data for table `artists`
--

LOCK TABLES `artists` WRITE;
/*!40000 ALTER TABLE `artists` DISABLE KEYS */;
INSERT INTO `artists` VALUES
(1,'Ольга','Черемных','artist',NULL,'2025-10-14 02:44:08','2025-10-14 02:44:08'),
(2,'Дмитрий','Каляка','artist',NULL,'2025-10-14 02:44:08','2025-10-14 02:44:08'),
(3,'Владимир','Целебровский','artist',NULL,'2025-10-14 02:44:08','2025-10-14 02:44:08'),
(4,'Андрей','Удалов','artist',NULL,'2025-10-14 02:44:08','2025-10-14 02:44:08'),
(5,'Иван','Красавцев','artist',NULL,'2025-10-14 02:44:08','2025-10-14 02:44:08'),
(6,'Юрий','Васильев','artist',NULL,'2025-10-14 02:44:08','2025-10-14 02:44:08'),
(7,'Семён','Фатыхов','artist',NULL,'2025-10-14 02:44:08','2025-10-14 02:44:08'),
(8,'Кирилл','Жуков','artist',NULL,'2025-10-14 02:44:08','2025-10-14 02:44:08'),
(9,'Кирилл','Костромин','artist',NULL,'2025-10-14 02:44:08','2025-10-14 02:44:08'),
(10,'Павел','Бубельников','conductor',NULL,'2025-10-14 02:44:08','2025-10-14 02:44:08'),
(11,'Сергей','Ермолаев','artist',NULL,'2025-10-14 02:44:08','2025-10-14 02:44:08'),
(13,'Людмила','Окель','artist',NULL,'2025-10-14 02:44:08','2025-10-14 02:44:08'),
(14,'Симеон','Асеев','artist',NULL,'2025-10-14 02:44:08','2025-10-14 02:44:08'),
(15,'Сергей','Румянцев','artist',NULL,'2025-10-14 02:44:08','2025-10-14 02:44:08'),
(16,'Анна','Старцева','artist',NULL,'2025-10-14 02:44:08','2025-10-14 02:44:08'),
(17,'Андрей','Матвеев','artist',NULL,'2025-10-14 02:44:08','2025-10-14 02:44:08'),
(18,'Александр','Подмешальский','artist',NULL,'2025-10-14 02:44:08','2025-10-14 02:44:08'),
(19,'Егор','Прокопьев','conductor',NULL,'2025-10-14 02:44:08','2025-10-14 02:44:08'),
(20,'Елизавета','Майданова','artist',NULL,'2025-10-14 02:44:08','2025-10-14 02:44:08'),
(22,'Елена','Журавлёва','artist',NULL,'2025-10-14 02:44:08','2025-10-14 02:44:08'),
(23,'Антон','Хомяков','artist',NULL,'2025-10-14 02:44:08','2025-10-14 02:44:08'),
(24,'Марина','Техтелёва','artist',NULL,'2025-10-14 02:44:08','2025-10-14 02:44:08'),
(25,'Анастасия','Ряполова','artist',NULL,'2025-10-14 02:44:08','2025-10-14 02:44:08'),
(26,'Анна','Кочетова','artist',NULL,'2025-10-14 02:44:08','2025-10-14 02:44:08'),
(27,'Денис','Колесников','artist',NULL,'2025-10-14 02:44:08','2025-10-14 02:44:08'),
(28,'Николай','Сысак','artist',NULL,'2025-10-14 02:44:08','2025-10-14 02:44:08'),
(29,'Сергей','Патракеев','artist',NULL,'2025-10-14 02:44:08','2025-10-14 02:44:08'),
(30,'Елизавета','Алексеева','artist',NULL,'2025-10-14 02:44:08','2025-10-14 02:44:08'),
(31,'Сауле','Искакова','artist',NULL,'2025-10-14 02:44:08','2025-10-14 02:44:08'),
(32,'Анна','Смирнова','artist',NULL,'2025-10-14 02:44:08','2025-10-14 02:44:08'),
(33,'Никита','Хвостов','artist',NULL,'2025-10-14 02:44:08','2025-10-14 02:44:08'),
(34,'Софья','Шех','artist',NULL,'2025-10-14 02:44:08','2025-10-14 02:44:08'),
(35,'Ольга','Шокель','artist',NULL,'2025-10-14 02:44:08','2025-10-14 02:44:08'),
(36,'Вероника','Ищенко','artist',NULL,'2025-10-14 02:44:08','2025-10-14 02:44:08'),
(37,'Владислав','Климов','artist',NULL,'2025-10-14 02:44:08','2025-10-14 14:32:11'),
(39,'Екатерина','Огнева','artist',NULL,'2025-10-14 02:44:08','2025-10-14 02:44:08'),
(40,'Алексей','Сазонов','artist',NULL,'2025-10-14 02:44:08','2025-10-14 02:44:08'),
(41,'Артур','Ераносов','conductor',NULL,'2025-10-14 02:44:08','2025-10-14 02:44:08'),
(42,'Полина','Ульянова','artist',NULL,'2025-10-14 02:44:08','2025-10-14 02:44:08'),
(43,'Дмитрий','Фёдоров','artist',NULL,'2025-10-14 02:44:08','2025-10-14 02:44:08'),
(44,'Евгений','Кузнецов','artist',NULL,'2025-10-14 02:44:08','2025-10-14 02:44:08'),
(45,'Елена','Понятовская','artist',NULL,'2025-10-14 02:44:08','2025-10-14 02:44:08'),
(46,'Екатерина','Ефимова','artist',NULL,'2025-10-14 02:44:08','2025-10-14 02:44:08'),
(47,'Екатерина','Агафонова','artist',NULL,'2025-10-14 02:44:08','2025-10-14 02:44:08'),
(48,'Анна','Снегова','artist',NULL,'2025-10-14 02:44:08','2025-10-14 02:44:08'),
(49,'Марат','Мухаметзянов','artist',NULL,'2025-10-14 02:44:08','2025-10-14 14:32:11'),
(50,'Максим','Левин','artist',NULL,'2025-10-14 02:44:08','2025-10-14 02:44:08'),
(51,'Александра','Бабаян','artist',NULL,'2025-10-14 02:44:08','2025-10-14 02:44:08'),
(52,'Надежда','Антюфеева','artist',NULL,'2025-10-14 02:44:08','2025-10-14 02:44:08'),
(54,'Анастасия','Солари','artist',NULL,'2025-10-14 02:44:08','2025-10-14 02:44:08'),
(55,'Андрей','Михеев','artist',NULL,'2025-10-14 02:44:08','2025-10-14 02:44:08'),
(56,'Николай','Погорелов','artist',NULL,'2025-10-14 02:44:08','2025-10-14 02:44:08'),
(57,'Анна','Григорьева','artist',NULL,'2025-10-14 02:44:08','2025-10-14 02:44:08'),
(58,'Екатерина','Каурова','artist',NULL,'2025-10-14 02:44:08','2025-10-14 02:44:08'),
(60,'Артём','Мисаженков','artist',NULL,'2025-10-14 02:44:08','2025-10-14 02:44:08'),
(61,'Игорь','Михайлов','pianist',NULL,'2025-10-14 02:44:08','2025-10-21 12:07:01'),
(62,'Ольга','Красных','artist',NULL,'2025-10-14 02:44:08','2025-10-14 02:44:08'),
(63,'Мария','Мукупа','artist',NULL,'2025-10-14 02:44:08','2025-10-14 02:44:08'),
(65,'Сергей','Алёшин','artist',NULL,'2025-10-14 02:44:08','2025-10-14 02:44:08'),
(66,'Любовь','Голубева','artist',NULL,'2025-10-14 02:44:08','2025-10-14 02:44:08'),
(67,'Юлия','Хуторецкая','artist',NULL,'2025-10-14 02:44:08','2025-10-14 02:44:08'),
(68,'Сергей','Ваганов','artist',NULL,'2025-10-14 02:44:08','2025-10-14 02:44:08'),
(69,'Екатерина','Хоменчук','artist',NULL,'2025-10-14 02:44:08','2025-10-14 02:44:08'),
(70,'Аркадий','Штейнлухт','conductor',NULL,'2025-10-14 02:44:08','2025-10-14 02:44:08'),
(71,'Ярослава','Раильтянина','artist',NULL,'2025-10-14 02:44:08','2025-10-14 02:44:08'),
(72,'Екатерина','Курбанова','artist',NULL,'2025-10-14 02:44:08','2025-10-14 02:44:08'),
(73,'Роман','Арндт','artist',NULL,'2025-10-14 02:44:08','2025-10-14 02:44:08'),
(74,'Ольга','Васильева','artist',NULL,'2025-10-14 02:44:08','2025-10-14 02:44:08'),
(75,'Сергей','Поваляев','artist',NULL,'2025-10-14 02:44:08','2025-10-14 02:44:08'),
(76,'Кирилл','Корсаков','artist',NULL,'2025-10-14 02:44:08','2025-10-14 02:44:08'),
(77,'Андрей','Стрельцов','artist',NULL,'2025-10-14 02:44:08','2025-10-14 02:44:08'),
(79,'Пётр','Максимов','conductor',NULL,'2025-10-14 02:44:08','2025-10-14 02:44:08'),
(80,'Артём','Тилинин','artist',NULL,'2025-10-14 02:44:08','2025-10-14 02:44:08'),
(81,'Анастасия','Рогова','artist',NULL,'2025-10-14 02:44:08','2025-10-14 02:44:08'),
(82,'Цзянин','Шэн','artist',NULL,'2025-10-14 02:44:08','2025-10-14 02:44:08'),
(83,'Екатерина','Албус','artist',NULL,'2025-10-14 02:44:08','2025-10-14 02:44:08'),
(85,'Валентина','Непряхина','artist',NULL,'2025-10-14 02:44:08','2025-10-14 02:44:08'),
(86,'Анна','Дарьянова','artist',NULL,'2025-10-14 02:44:08','2025-10-14 02:44:08'),
(87,'Полина','Поляцкая','artist',NULL,'2025-10-14 02:44:08','2025-10-14 02:44:08'),
(89,'Евгения','Испавская','artist',NULL,'2025-10-14 02:44:08','2025-10-14 02:44:08'),
(90,'Ольга','Фурман','artist',NULL,'2025-10-14 02:44:08','2025-10-14 02:44:08'),
(91,'Павел','Сопов','artist',NULL,'2025-10-14 02:44:08','2025-10-14 02:44:08'),
(92,'Анна','Щербакова','artist',NULL,'2025-10-14 02:44:08','2025-10-14 02:44:08'),
(93,'Виталий','Гордиенко','artist',NULL,'2025-10-14 02:44:09','2025-10-14 02:44:09'),
(94,'Дарья','Росицкая','artist',NULL,'2025-10-14 02:44:09','2025-10-14 02:44:09'),
(95,'Олег','Нестеров','artist',NULL,'2025-10-14 02:44:09','2025-10-14 02:44:09'),
(96,'Виктория','Романова','artist',NULL,'2025-10-14 02:44:09','2025-10-14 02:44:09'),
(97,'Анна','Евтушенко','artist',NULL,'2025-10-14 02:44:09','2025-10-14 02:44:09'),
(98,'Юлия','Андрушкевич','artist',NULL,'2025-10-14 02:44:09','2025-10-14 02:44:09'),
(99,'Иван','Васильев','artist',NULL,'2025-10-14 02:44:09','2025-10-14 02:44:09'),
(100,'Анатолий','Рыбалко','conductor',NULL,'2025-10-14 02:44:09','2025-10-14 02:44:09'),
(103,'Екатерина','Анисимова','artist',NULL,'2025-10-14 02:44:09','2025-10-14 02:44:09'),
(104,'Никита','Светлов','artist',NULL,'2025-10-14 02:44:09','2025-10-14 02:44:09'),
(105,'Евгения','Терновцева','artist',NULL,'2025-10-14 02:44:09','2025-10-14 02:44:09'),
(106,'Анна','Коротаева','pianist',NULL,'2025-10-14 02:44:09','2025-10-14 02:44:09'),
(108,'Анна','Дугина','artist',NULL,'2025-10-14 02:44:09','2025-10-14 02:44:09'),
(110,'Дарья','Косенко-Вишневецкая','artist',NULL,'2025-10-14 02:44:09','2025-10-14 02:44:09'),
(111,'','студенты РГИСИ (мастерская А. Петрова)','group',NULL,'2025-10-14 02:44:09','2025-10-14 21:15:22'),
(112,'Елена','Миляева','artist',NULL,'2025-10-14 02:44:09','2025-10-14 02:44:09'),
(114,'Никита','Козулин','artist',NULL,'2025-10-14 02:44:09','2025-10-14 02:44:09'),
(115,'Елена','Терновая','artist',NULL,'2025-10-14 02:44:09','2025-10-14 02:44:09'),
(118,'Николай','Мазаев','conductor',NULL,'2025-10-14 02:44:09','2025-10-14 02:44:09'),
(119,'Дмитрий','Танеев','artist',NULL,'2025-10-14 02:44:09','2025-10-14 02:44:09'),
(122,'Дамир','Закиров','artist',NULL,'2025-10-14 02:44:10','2025-10-14 02:44:10'),
(126,'Мария','Граничнова','artist',NULL,'2025-10-14 02:44:10','2025-10-14 02:44:10'),
(129,'Иван','Мельник','artist',NULL,'2025-10-14 02:44:10','2025-10-14 02:44:10'),
(130,'Сергей','Михайлычев','artist',NULL,'2025-10-14 02:44:10','2025-10-14 02:44:10'),
(131,'Юлия','Розовская','artist',NULL,'2025-10-14 02:44:10','2025-10-14 02:44:10'),
(132,'Константин','Ефимов','artist',NULL,'2025-10-14 02:44:10','2025-10-14 02:44:10'),
(133,'Игорь','Лищишин','artist',NULL,'2025-10-14 02:44:10','2025-10-14 02:44:10'),
(134,'Андрей','Прысь','artist',NULL,'2025-10-14 02:44:10','2025-10-14 02:44:10'),
(137,'Кирилл','Павлов','artist',NULL,'2025-10-14 02:44:10','2025-10-14 02:44:10'),
(138,'','ансамбль','group',NULL,'2025-10-14 15:27:51','2025-10-14 15:27:51'),
(139,'','детский хор','group',NULL,'2025-10-14 15:27:51','2025-10-14 15:27:51'),
(140,'','оркестр','group',NULL,'2025-10-14 15:30:44','2025-10-14 15:30:44'),
(143,'Татьяна','Закирова','artist',NULL,'2025-10-14 19:32:28','2025-10-14 19:32:28'),
(144,'Антон','Авдеев','artist',NULL,'2025-10-14 19:58:35','2025-10-14 19:58:35'),
(169,'Альберт','Асадуллин','artist',NULL,'2025-10-14 20:30:32','2025-10-14 20:30:32'),
(170,'Елена','Заставная','artist',NULL,'2025-10-14 20:39:57','2025-10-14 20:39:57'),
(179,'','артисты театра','group',NULL,'2025-10-21 11:07:56','2025-10-21 11:07:56'),
(181,'Настасья','Янюшкина','artist',NULL,'2025-10-31 23:47:31','2025-10-31 23:47:31'),
(182,'Максим','Савватеев','artist',NULL,'2025-10-31 23:47:31','2025-10-31 23:47:31'),
(183,'Игорь','Михайлов','artist',NULL,'2025-11-04 14:07:01','2025-11-04 14:07:01'),
(192,'Егор','Прокопьев','pianist',NULL,'2025-11-07 22:19:49','2025-11-07 22:19:49');
/*!40000 ALTER TABLE `artists` ENABLE KEYS */;
UNLOCK TABLES;

--
-- Table structure for table `events_raw`
--

DROP TABLE IF EXISTS `events_raw`;
/*!40101 SET @saved_cs_client     = @@character_set_client */;
/*!40101 SET character_set_client = utf8mb4 */;
CREATE TABLE `events_raw` (
  `id` int(11) NOT NULL AUTO_INCREMENT,
  `batch_token` char(36) NOT NULL,
  `event_date` date NOT NULL,
  `event_time` time NOT NULL,
  `title` varchar(255) NOT NULL,
  `normalized_title` varchar(255) DEFAULT NULL,
  `age_category` varchar(100) DEFAULT NULL,
  `ticket_code` varchar(20) DEFAULT NULL,
  `ticket_url` varchar(255) DEFAULT NULL,
  `repertoire_url` varchar(255) DEFAULT NULL,
  `background_url` varchar(255) DEFAULT NULL,
  `vk_post_text` text DEFAULT NULL,
  `is_published_vk` tinyint(1) DEFAULT 0,
  `play_id` int(11) DEFAULT NULL,
  `play_short_name` varchar(50) DEFAULT NULL,
  `month` tinyint(4) NOT NULL,
  `year` smallint(6) NOT NULL,
  `created_at` timestamp NULL DEFAULT current_timestamp(),
  `updated_at` timestamp NULL DEFAULT current_timestamp() ON UPDATE current_timestamp(),
  `vk_page_name` varchar(255) DEFAULT NULL,
  PRIMARY KEY (`id`),
  UNIQUE KEY `uniq_batch_event` (`batch_token`,`event_date`,`event_time`,`title`),
  KEY `idx_events_raw_month_year` (`year`,`month`),
  KEY `idx_events_raw_ticket_code` (`ticket_code`),
  KEY `events_raw_ibfk_1` (`play_id`),
  CONSTRAINT `events_raw_ibfk_1` FOREIGN KEY (`play_id`) REFERENCES `plays` (`id`) ON DELETE SET NULL
) ENGINE=InnoDB AUTO_INCREMENT=122 DEFAULT CHARSET=utf8mb4 COLLATE=utf8mb4_general_ci;
/*!40101 SET character_set_client = @saved_cs_client */;

--
-- Dumping data for table `events_raw`
--

LOCK TABLES `events_raw` WRITE;
/*!40000 ALTER TABLE `events_raw` DISABLE KEYS */;
INSERT INTO `events_raw` VALUES
(1,'620c3de6-4fb4-4a40-810c-ab417d3a5989','2025-11-01','12:00:00','Финист ясный сокол','финист ясный сокол','Для всей семьи','1645','https://www.zazerkal.spb.ru/tickets/1645.htm','https://www.zazerkal.spb.ru/repertoire/product145.htm','https://www.zazerkal.spb.ru/images/data/repertoire/145_small_1591802906.jpg','Сказитель — Виталий Гордиенко\nФинист — Никита Козулин\nОтец — Сергей Румянцев\nСтаршая дочь — Екатерина Курбанова\nСредняя дочь — Анна Кочетова\nМеньшая дочь — Елена Миляева\nКузнец, Старинушка — Андрей Удалов\nБаба-Яга младшая — Анна Кочетова\nБаба-Яга средняя — Юрий Васильев\nБаба-Яга старшая — Андрей Удалов\nПросвирня — Сергей Румянцев\nДочь Просвирни — Евгения Испавская\nКупцы — Юрий Васильев, Сергей Ваганов\nПлакальщица — Анна Евтушенко\nДирижёр — Пётр Максимов\n\n\'\'\'[http://www.zazerkал.spb.ru/tickets/1645.htm|КУПИТЬ БИЛЕТ]\'\'\'',0,38,'Финист',11,2025,'2025-10-09 14:42:47','2025-11-07 22:15:07','Финист_Ясный_Сокол_01.11.25'),
(2,'620c3de6-4fb4-4a40-810c-ab417d3a5989','2025-11-01','19:00:00','Летучая мышь','летучая мышь','Для взрослых','1647','https://www.zazerkal.spb.ru/tickets/1647.htm','https://www.zazerkal.spb.ru/repertoire/product187.htm','https://www.zazerkal.spb.ru/images/data/repertoire/187_small_1729623828.jpg','==В ролях:==\n\'\'\'Генрих Айзенштайн\'\'\' — Сергей Ермолаев\n\'\'\'Розалинда\'\'\', его жена — Анна Снегова\n\'\'\'Адель\'\'\', их горничная — Людмила Окель\n\'\'\'Фальк\'\'\', директор театра — Николай Погорелов\n\'\'\'Альфред\'\'\', поклонник Розалинды — Симеон Асеев\n\'\'\'Франк\'\'\', директор тюрьмы — Алексей Сазонов\n\'\'\'Князь Орловский\'\'\' — Анна Старцева\n\'\'\'Лесничий\'\'\' — Николай Сысак\n\'\'\'Дежурный тюрьмы\'\'\' — Андрей Матвеев\n\'\'\'Неизвестный\'\'\' — Николай Сысак\n\'\'\'Блинд\'\'\', адвокат Айзенштайна — Александр Подмешальский\n\n[[photo-35124177_281223453|450x300px| ]]\n\n\'\'\'Дирижёр\'\'\' — Егор Прокопьев\n\n\'\'\'[http://www.zazerkал.spb.ru/tickets/1647.htm|КУПИТЬ БИЛЕТ]\'\'\'',0,2,'Летучка',11,2025,'2025-10-09 14:42:47','2025-11-07 22:15:07','Летучая_мышь_01.11.25'),
(3,'620c3de6-4fb4-4a40-810c-ab417d3a5989','2025-11-02','12:00:00','Старик Хоттабыч','старик хоттабыч','Для всей семьи','1649','https://www.zazerkal.spb.ru/tickets/1649.htm','https://www.zazerkal.spb.ru/repertoire/product143.htm','https://www.zazerkal.spb.ru/images/data/repertoire/143_small_1746126780.jpg','==В ролях:==\n\'\'\'Хоттабыч\'\'\' — Андрей Матвеев\n\'\'\'Волька\'\'\' — Дмитрий Фёдоров\n\'\'\'Женька\'\'\' — Ольга Красных\n\'\'\'Омар; Михаил Исаевич\'\'\', врач скорой помощи — Сергей Патракеев\n\'\'\'Алевтина\'\'\', пионервожатая — Ярослава Раильтянина\n\'\'\'Сергей Семёнович\'\'\', учитель географии — Николай Сысак\n\'\'\'Сидоров\'\'\', старший лейтенант; \'\'\'Дамир Амирович\'\'\', продавец — Андрей Удалов\n\'\'\'Сержант Смирнова\'\'\' — Любовь Голубева\n\'\'\'Сулейман-ибн-Дауд и Пантелеймон Кузьмич\'\'\' — Марат Мухаметзянов (\'\'впервые в роли\'\')\n\'\'\'Сотрудницы сберкассы\'\'\' — Елена Понятовская, Евгения Испавская, Ольга Фурман\n\'\'\'Наталья Кузьминична Пилюкина\'\'\' — Екатерина Огнева\n\'\'\'Гога Пилюкин\'\'\' — Сергей Поваляев (\'\'впервые в роли\'\')\n\'\'\'Пионеры, людоеды, ифриты, футболисты\'\'\' — Никита Хвостов, Антон Хомяков, Максим Савватеев (\'\'впервые в роли\'\'), Максим Левин, Юрий Васильев\n\'\'\'Москвички\'\'\' — Полина Ульянова, Екатерина Ефимова, Анастасия Янюшкина, Анна Григорьева\n\'\'\'Водолазы\'\'\' — Сергей Ваганов, Кирилл Корсаков, Павел Сопов\n\'\'\'Пионерки\'\'\' — Полина Поляцкая, Екатерина Агафонова, Ольга Шокель, Анна Щербакова\n\n[[photo-35124177_457239607|450x300px| ]]\n\n\n\'\'\'[http://www.zazerkал.spb.ru/tickets/1649.htm|КУПИТЬ БИЛЕТ]\'\'\'',0,14,'Хоттабыч',11,2025,'2025-10-09 14:42:48','2025-11-07 22:15:07','Старик_Хоттабыч_02.11.25'),
(4,'620c3de6-4fb4-4a40-810c-ab417d3a5989','2025-11-02','15:00:00','КУ-КА-РЕ-КУ!','ку ка ре ку','Для всей семьи','1665','https://www.zazerkal.spb.ru/tickets/1665.htm','https://www.zazerkal.spb.ru/repertoire/product332.htm','https://www.zazerkal.spb.ru/images/data/repertoire/332_small_1727900961.jpg','==В ролях:==\n\'\'\'Попугай\'\'\', организатор фестиваля — Дмитрий Фёдоров\n\'\'\'Ёжик\'\'\', его помощник — Настасья Янюшкина\n\'\'\'Петушок\'\'\' — Антон Хомяков\n\'\'\'Наседка\'\'\' — Елизавета Майданова\n\'\'\'Свинка\'\'\' — Ярослава Раильтянина\n\'\'\'Кошка\'\'\' — Елизавета Алексеева\n\'\'\'Лягушка\'\'\' — Анна Григорьева\n\'\'\'Ансамбль лягушек\'\'\' — Софья Шех, Полина Ульянова, Ольга Красных, Екатерина Каурова\n\'\'\'Волк\'\'\' — Евгений Кузнецов\n\'\'\'Пёс\'\'\' — Максим Савватеев\n\'\'\'Лес\'\'\' — ансамбль\n\n[[photo-35124177_457239805|400x267px| ]]\n\n\n\'\'\'[http://www.zazerkал.spb.ru/tickets/1665.htm|КУПИТЬ БИЛЕТ]\'\'\'',0,12,'Кукареку',11,2025,'2025-10-09 14:42:48','2025-11-07 22:15:07','Ку-ка-ре-ку!_02.11.25'),
(5,'620c3de6-4fb4-4a40-810c-ab417d3a5989','2025-11-02','19:00:00','Декамерон','декамерон','Для взрослых','1664','https://www.zazerkal.spb.ru/tickets/1664.htm','https://www.zazerkal.spb.ru/repertoire/product165.htm','https://www.zazerkal.spb.ru/images/data/repertoire/165_small_1733324867.jpg','==В ролях:==\n===Пролог===\n\'\'\'Панфилио\'\'\' — Максим Левин\n\'\'\'Пармено\'\'\' — Семён Фатыхов\n\'\'\'Филострато\'\'\' — Денис Колесников\n\'\'\'Сириск\'\'\' — Сергей Поваляев\n\'\'\'Тиндаро\'\'\' — Сергей Ваганов\n\'\'\'Пампинея\'\'\' — Ольга Васильева\n\'\'\'Фьяметта\'\'\' — Валентина Непряхина\n\'\'\'Филомена\'\'\' — Екатерина Каурова\n\'\'\'Эмилия\'\'\' — Елизавета Алексеева\n\'\'\'Лауретта\'\'\' — Анна Григорьева\n\n===Новелла первая. Болтливый постоялец===\n\'\'\'Адриано\'\'\' — Семён Фатыхов\n\'\'\'Пинуччо\'\'\' — Максим Левин\n\'\'\'Бруно\'\'\', хозяин постоялого двора — Денис Колесников\n\'\'\'Никколоза\'\'\', дочь — Екатерина Каурова\n\'\'\'Аделина\'\'\', мать — Анна Дарьянова\n\n===Новелла вторая. Чем следует кормить гусынь?===\n\'\'\'Отец\'\'\' — Николай Сысак\n\'\'\'Антонио\'\'\' — Кирилл Корсаков\n\'\'\'Лизетта\'\'\' — Ярослава Раильтянина\n\'\'\'Брат Альберто\'\'\' — Сергей Ваганов\n\n===Новелла третья. Прекрасный визирь===\n\'\'\'Сибилла\'\'\', она же \'\'\'Сиккурано\'\'\' — Ольга Васильева\n\'\'\'Барнабо\'\'\', муж — Сергей Ваганов\n\'\'\'Амброджо\'\'\' — Денис Колесников\n\'\'\'Каллисто\'\'\', слуга — Семён Фатыхов\n\'\'\'Стражники\'\'\' — Максим Левин, Кирилл Корсаков\n\n===Новелла четвёртая. Горшок с базиликом===\n\'\'\'Лизабетта\'\'\' — Людмила Окель\n\'\'\'Лоренцо\'\'\' — Сергей Ваганов\n\'\'\'Старший брат\'\'\' — Николай Сысак\n\'\'\'Младший брат\'\'\' — Семён Фатыхов\n\'\'\'Служанка\'\'\' — Екатерина Огнева\n\n===Новелла пятая. Сокол Федериго===\n\'\'\'Федериго\'\'\' — Максим Левин\n\'\'\'Виоланта\'\'\' — Анастасия Рогова\n\'\'\'Чинчо\'\'\' — Николай Сысак\n\'\'\'Пинчо\'\'\' — Сергей Алёшин\n\'\'\'Сокол\'\'\' — Семён Фатыхов\n\n===Новелла шестая. Чепец настоятельницы===\n\'\'\'Настоятельница\'\'\' — Анна Дарьянова\n\'\'\'Агнесса\'\'\' — Екатерина Огнева\n\'\'\'Клара\'\'\' — Елизавета Алексеева\n\'\'\'Бригитта\'\'\' — Анна Григорьева\n\'\'\'Изабетта\'\'\' — Екатерина Ефимова (\'\'впервые в роли\'\')\n\'\'\'Лючия\'\'\' — Екатерина Каурова\n\'\'\'Анна\'\'\' — Полина Поляцкая\n\'\'\'Дарина\'\'\' — Ольга Васильева\n\'\'\'Полетта\'\'\' — Анастасия Рогова\n\'\'\'Мазетто\'\'\' — Кирилл Корсаков\n\'\'\'Отец Никодим\'\'\' — Николай Сысак\n\'\'\'Настасио\'\'\' — Сергей Ваганов\n\'\'\'Скелет Трувильды\'\'\' — Сергей Поваляев\n\n[[photo-35124177_457239531]]\n\n\'\'\'Дирижёр\'\'\' — Егор Прокопьев\n\n\n\'\'\'[http://www.zazerkal.spb.ru/tickets/1664.htm|КУПИТЬ БИЛЕТ]\'\'\'',0,13,'Декамерон',11,2025,'2025-10-09 14:42:48','2025-11-07 22:15:07','Декамерон_02.11.25'),
(6,'620c3de6-4fb4-4a40-810c-ab417d3a5989','2025-11-06','19:00:00','Отелло','отелло','Для взрослых','1648','https://www.zazerkal.spb.ru/tickets/1648.htm','https://www.zazerkal.spb.ru/repertoire/product196.htm','https://www.zazerkal.spb.ru/images/data/repertoire/196_small_1747944424.jpeg','==В ролях:==\n\'\'\'Отелло\'\'\' — Дмитрий Каляка\n\'\'\'Дездемона\'\'\' — Елена Миляева\n\'\'\'Яго\'\'\' — Владимир Целебровский\n\'\'\'Эмилия\'\'\' — Анна Старцева\n\'\'\'Кассио\'\'\' — Никита Козулин\n\'\'\'Родриго\'\'\' — Юрий Васильев\n\'\'\'Лодовико\'\'\' — Александр Подмешальский\n\'\'\'Монтано\'\'\' — Андрей Удалов\n\'\'\'Герольд\'\'\' — Кирилл Костромин\n\n[[photo403958_457260985|450x300px| ]]\n\n\'\'\'Дирижёр\'\'\' — Павел Бубельников\n\n\'\'\'[http://www.zazerkал.spb.ru/tickets/1648.htm|КУПИТЬ БИЛЕТ]\'\'\'',0,53,'Отелло',11,2025,'2025-10-09 14:42:48','2025-11-07 22:15:07','Отелло_06.11.25'),
(7,'620c3de6-4fb4-4a40-810c-ab417d3a5989','2025-11-08','12:00:00','Кошкин дом','кошкин дом','Для детей','1646','https://www.zazerkal.spb.ru/tickets/1646.htm','https://www.zazerkal.spb.ru/repertoire/product286.htm','https://www.zazerkal.spb.ru/images/data/repertoire/286_small_1729007022.jpg','==В ролях:==\n\'\'\'Кошка\'\'\' — Ольга Васильева\n\'\'\'Кот Василий\'\'\' — Андрей Удалов\n\'\'\'Котята\'\'\' — Марина Техтелёва, Полина Ульянова\n\'\'\'Козёл\'\'\' — Юрий Васильев\n\'\'\'Коза\'\'\' — Ярослава Раильтянина\n\'\'\'Петух\'\'\' — Сергей Ваганов\n\'\'\'Курица\'\'\' — Анна Щербакова\n\'\'\'Свинья\'\'\' — Александр Подмешальский\n\'\'\'Бобёр\'\'\' — Сергей Поваляев\n\n\'\'\'Пожарные\'\'\', \'\'\'огонь\'\'\', \'\'\'петушки\'\'\', \'\'\'поросята\'\'\' — артисты театра\n\n[[photo-35124177_457239591|450x300px| ]]\n\n\'\'\'Дирижёр\'\'\' — Егор Прокопьев\n\n\n\'\'\'[http://www.zazerkal.spb.ru/tickets/1646.htm|КУПИТЬ БИЛЕТ]\'\'\'',0,56,'Кошкин',11,2025,'2025-10-09 14:42:48','2025-11-07 22:15:07','Кошкин_дом_08.11.25'),
(8,'620c3de6-4fb4-4a40-810c-ab417d3a5989','2025-11-08','15:00:00','Три поросенка','три поросенка','Для детей','1663','https://www.zazerkal.spb.ru/tickets/1663.htm','https://www.zazerkal.spb.ru/repertoire/product164.htm','https://www.zazerkal.spb.ru/images/data/repertoire/164_small_1727892096.jpg','==В ролях:==\n\'\'\'Наф-Наф\'\'\' — Елизавета Алексеева\n\'\'\'Нуф-Нуф\'\'\' — Анастасия Янюшкина\n\'\'\'Ниф-Ниф\'\'\' — Ярослава Раильтянина\n\'\'\'Волк\'\'\' — Андрей Михеев\n\n[[photo-35124177_280681510|450px| ]]\n\n\n\'\'\'[http://www.zazerkal.spb.ru/tickets/1663.htm|КУПИТЬ БИЛЕТ]\'\'\'',0,8,'Свиньи',11,2025,'2025-10-09 14:42:48','2025-11-07 22:15:07','Три_поросёнка_08.11.25'),
(9,'620c3de6-4fb4-4a40-810c-ab417d3a5989','2025-11-08','19:00:00','Порги и Бесс','порги и бесс','Для взрослых','1650','https://www.zazerkal.spb.ru/tickets/1650.htm','https://www.zazerkal.spb.ru/repertoire/product172.htm','https://www.zazerkal.spb.ru/images/data/repertoire/172_small_1742506127.png','==В ролях:==\n\'\'\'Порги\'\'\' — Иван Красавцев\n\'\'\'Бесс\'\'\' — Анна Снегова\n\'\'\'Краун\'\'\' — Алексей Сазонов\n\'\'\'Спортинг Лайф\'\'\' — Андрей Матвеев\n\'\'\'Сирина\'\'\' — Екатерина Курбанова\n\'\'\'Клара\'\'\' — Сауле Искакова\n\'\'\'Мария\'\'\' — Ольга Шокель\n\'\'\'Энн\'\'\' — Елена Журавлёва\n\'\'\'Сципио\'\'\' — Ольга Красных\n\'\'\'Лили\'\'\' — Екатерина Агафонова\n\'\'\'Роббинс\'\'\' — Никита Хвостов\n\'\'\'Джейк\'\'\' — Денис Колесников\n\'\'\'Питер\'\'\' — Сергей Патракеев\n\'\'\'Минго\'\'\' — Сергей Ермолаев\n\'\'\'Джим\'\'\' — Андрей Михеев\n\'\'\'Адвокат\'\'\' — Кирилл Костромин\n\'\'\'Следователь\'\'\' — Сергей Румянцев\n\'\'\'Гробовщик\'\'\' — Кирилл Жуков\n\'\'\'Детектив\'\'\' — Николай Погорелов\n\'\'\'Крабмэн\'\'\' — Сергей Ермолаев\n\'\'\'Продавщица клубники\'\'\' — Анна Кочетова\n\'\'\'Девушки\'\'\' — Анна Григорьева, Полина Поляцкая, Анна Кочетова, Екатерина Каурова, Софья Шех\n\'\'\'Рыбаки\'\'\' — Евгений Кузнецов, Антон Хомяков\n\n[[photo-35124177_312053592|450x300px| ]]\n\n\'\'\'Дирижёр\'\'\' — Егор Прокопьев\n\'\'\'Джазбо-Браун\'\'\' — Игорь Михайлов\n\n\n\'\'\'[http://www.zazerkal.spb.ru/tickets/1650.htm|КУПИТЬ БИЛЕТ]\'\'\'',0,6,'Порги',11,2025,'2025-10-09 14:42:48','2025-11-07 22:15:07','Порги_и_Бесс_08.11.25'),
(10,'620c3de6-4fb4-4a40-810c-ab417d3a5989','2025-11-09','15:00:00','Синяя птица','синяя птица','Для всей семьи','1651','https://www.zazerkal.spb.ru/tickets/1651.htm','https://www.zazerkal.spb.ru/repertoire/product328.htm','https://www.zazerkal.spb.ru/images/data/repertoire/328_small_1733326862.jpg','==В ролях:==\n\'\'\'Тильтиль\'\'\' — Антон Хомяков\n\'\'\'Митиль\'\'\' — Анастасия Солари\n\'\'\'Мать\'\'\' — Елена Заставная\n\'\'\'Господин Светеборг\'\'\' / \'\'\'Волшебник Свет\'\'\' — Антон Авдеев\n\'\'\'Внучка\'\'\' — Анастасия Янюшкина\n\'\'\'Кошка Тилетта\'\'\' — Анна Кочетова\n\'\'\'Пёс Тило\'\'\' — Денис Колесников\n\'\'\'Сахар\'\'\' — Павел Сопов\n\'\'\'Хлеб\'\'\' — Сергей Патракеев\n\'\'\'Молоко\'\'\' — Елизавета Алексеева\n\'\'\'Бабушка\'\'\' — Сауле Искакова\n\'\'\'Дедушка\'\'\' — Андрей Матвеев\n\'\'\'Ночь\'\'\' — Анна Григорьева\n\'\'\'Ворон\'\'\' — Никита Хвостов\n\'\'\'Дуб\'\'\' — Иван Красавцев\n\'\'\'Липа\'\'\' — Софья Шех\n\'\'\'Ива\'\'\' — Елена Журавлёва\n\'\'\'Берёза\'\'\' — Ольга Шокель\n\'\'\'Плющ\'\'\' — Вероника Ищенко\n\'\'\'Волк\'\'\' — Никита Хвостов\n\'\'\'Медведь\'\'\' — Владислав Климов\n\'\'\'Зубр\'\'\' — Сергей Поваляев\n\'\'\'Полное Наслаждение\'\'\' — Кирилл Жуков\n\'\'\'Менее полное Наслаждение\'\'\' — Андрей Матвеев\n\'\'\'Сладость\'\'\' — Екатерина Огнева\n\'\'\'Старец Время\'\'\' — Алексей Сазонов\n\n[[photo-35124177_457239776|400x267px| ]]\n\n\'\'\'Дирижёр\'\'\' — Артур Ераносов\n\n\n\'\'\'[http://www.zazerkal.spb.ru/tickets/1651.htm|КУПИТЬ БИЛЕТ]\'\'\'',0,4,'СП',11,2025,'2025-10-09 14:42:48','2025-11-07 22:15:07','Синяя_птица_09.11.25_15'),
(11,'620c3de6-4fb4-4a40-810c-ab417d3a5989','2025-11-09','19:00:00','Синяя птица','синяя птица','Для всей семьи','1652','https://www.zazerkal.spb.ru/tickets/1652.htm','https://www.zazerkal.spb.ru/repertoire/product328.htm','https://www.zazerkal.spb.ru/images/data/repertoire/328_small_1733326862.jpg','==В ролях:==\n\'\'\'Тильтиль\'\'\' — Антон Хомяков\n\'\'\'Митиль\'\'\' — Анастасия Солари\n\'\'\'Мать\'\'\' — Елена Заставная\n\'\'\'Господин Светеборг\'\'\' / \'\'\'Волшебник Свет\'\'\' — Альберт Асадуллин\n\'\'\'Внучка\'\'\' — Анастасия Янюшкина\n\'\'\'Кошка Тилетта\'\'\' — Анна Кочетова\n\'\'\'Пёс Тило\'\'\' — Денис Колесников\n\'\'\'Сахар\'\'\' — Павел Сопов\n\'\'\'Хлеб\'\'\' — Сергей Патракеев\n\'\'\'Молоко\'\'\' — Елизавета Алексеева\n\'\'\'Бабушка\'\'\' — Елена Терновая\n\'\'\'Дедушка\'\'\' — Андрей Матвеев\n\'\'\'Ночь\'\'\' — Анна Григорьева\n\'\'\'Ворон\'\'\' — Никита Хвостов\n\'\'\'Дуб\'\'\' — Иван Красавцев\n\'\'\'Липа\'\'\' — Софья Шех\n\'\'\'Ива\'\'\' — Елена Журавлёва\n\'\'\'Берёза\'\'\' — Ольга Шокель\n\'\'\'Плющ\'\'\' — Вероника Ищенко\n\'\'\'Волк\'\'\' — Никита Хвостов\n\'\'\'Медведь\'\'\' — Владислав Климов\n\'\'\'Зубр\'\'\' — Сергей Поваляев\n\'\'\'Полное Наслаждение\'\'\' — Кирилл Жуков\n\'\'\'Менее полное Наслаждение\'\'\' — Андрей Матвеев\n\'\'\'Сладость\'\'\' — Екатерина Огнева\n\'\'\'Старец Время\'\'\' — Алексей Сазонов\n\n[[photo-35124177_457239776|400x267px| ]]\n\n\'\'\'Дирижёр\'\'\' — Артур Ераносов\n\n\n\'\'\'[http://www.zazerkal.spb.ru/tickets/1652.htm|КУПИТЬ БИЛЕТ]\'\'\'',0,4,'СП',11,2025,'2025-10-09 14:42:48','2025-11-07 22:15:07','Синяя_птица_09.11.25_19'),
(12,'620c3de6-4fb4-4a40-810c-ab417d3a5989','2025-11-14','11:00:00','Абонемент № 2. Сказки для тебя и твоих друзей!','абонемент 2 сказки для тебя и твоих друзей','Для всей семьи','1586','https://www.zazerkal.spb.ru/tickets/1586.htm','https://www.zazerkal.spb.ru/repertoire/product298.htm','https://www.zazerkal.spb.ru/images/img/plug.jpg','==В ролях:==\n\'\'\'Муравьишка\'\'\', он же \'\'\'Мур\'\'\' — Семён Фатыхов\n\'\'\'Вейка\'\'\', его подружка — Екатерина Ефимова\n\'\'\'Чер\'\'\' — Максим Левин\n\'\'\'Паучок-дирижёр\'\'\' — Анна Щербакова\n\'\'\'Бабочка\'\'\' — Анна Дарьянова\n\'\'\'Жук\'\'\' — Сергей Румянцев\n\'\'\'Водомерка\'\'\' — Мария Мукупа\n\'\'\'Первый привратник\'\'\' — Сергей Ваганов\n\'\'\'Второй привратник\'\'\' — Сергей Ермолаев\n\'\'\'Жители муравейника\'\'\' — Людмила Окель, Антон Хомяков, Елизавета Алексеева, Анна Григорьева, Ярослава Раильтянина, Кирилл Корсаков\n\n[[photo-35124177_457239684|400x267px| ]]\n\n\'\'\'Дирижёр\'\'\' — Егор Прокопьев\n\n\n\'\'\'[http://www.zazerkal.spb.ru/tickets/1586.htm|КУПИТЬ БИЛЕТ]\'\'\'',0,25,'Муравей',11,2025,'2025-10-09 14:42:48','2025-11-07 22:15:07','Путешествие_муравьишки_14.11.25'),
(13,'620c3de6-4fb4-4a40-810c-ab417d3a5989','2025-11-14','19:00:00','Волшебная флейта','волшебная флейта','Для всей семьи','1654','https://www.zazerkal.spb.ru/tickets/1654.htm','https://www.zazerkal.spb.ru/repertoire/product155.htm','https://www.zazerkal.spb.ru/images/data/repertoire/155_small_1727899863.jpg','==В ролях:==\n\'\'\'Памина\'\'\' — Татьяна Закирова\n\'\'\'Тамино\'\'\' — Роман Арндт\n\'\'\'Царица ночи\'\'\' — Виктория Романова\n\'\'\'Папагено\'\'\' — Владислав Климов (\'\'впервые в роли\'\')\n\'\'\'Папагена\'\'\' — Марина Техтелёва\n\'\'\'Моностатос\'\'\' — Николай Погорелов\n\'\'\'Зарастро\'\'\' — Андрей Удалов\n\'\'\'Дамы\'\'\' — Людмила Окель, Екатерина Каурова, Ольга Шокель\n\'\'\'Мальчики\'\'\' — Екатерина Ефимова, Ольга Красных, Полина Поляцкая\n\'\'\'Ритор\'\'\' — Сергей Ермолаев\n\'\'\'Оратор\'\'\' — Сергей Румянцев\n\'\'\'Старуха Папагена\'\'\' — Екатерина Огнева\n\'\'\'Флейтист\'\'\' — Сергей Ваганов\n\n[[photo-35124177_288940584|450x300px| ]]\n\n\'\'\'Дирижёр\'\'\' — Аркадий Штейнлухт\n\n\n\'\'\'[http://www.zazerkal.spb.ru/tickets/1654.htm|КУПИТЬ БИЛЕТ]\'\'\'',0,49,'Флейта',11,2025,'2025-10-09 14:42:48','2025-11-07 22:15:07','Волшебная_флейта_14.11.25'),
(14,'620c3de6-4fb4-4a40-810c-ab417d3a5989','2025-11-15','12:00:00','Приключения Незнайки','приключения незнайки','Для всей семьи','1657','https://www.zazerkal.spb.ru/tickets/1657.htm','https://www.zazerkal.spb.ru/repertoire/product159.htm','https://www.zazerkal.spb.ru/images/data/repertoire/159_small_1729624731.jpg','==В ролях:==\n\'\'\'Незнайка\'\'\' — Антон Хомяков\n\'\'\'Знайка\'\'\' — Кирилл Костромин\n\'\'\'Цветик\'\'\' — Сергей Патракеев\n\'\'\'Гусля\'\'\' — Андрей Михеев\n\'\'\'Тюбик\'\'\' — Андрей Удалов\n\'\'\'Шпунтик\'\'\' — Олег Нестеров\n\'\'\'Грабля\'\'\' — Сергей Румянцев\n\'\'\'Кнопочка\'\'\' — Марина Техтелёва\n\'\'\'Пуговка\'\'\' — Ольга Красных\n\'\'\'Гунька\'\'\' — Сергей Ермолаев\n\'\'\'Пегасик\'\'\' — Артём Мисаженков\n\'\'\'Совесть\'\'\' — Любовь Голубева\n\'\'\'Синеглазка\'\'\' — Анастасия Янюшкина\n\'\'\'Медуница\'\'\' — Полина Ульянова\n\'\'\'Белочка\'\'\' — Елена Журавлёва\n\'\'\'Маргаритка\'\'\' — Елизавета Майданова\n\'\'\'Кубышка\'\'\' — Валентина Непряхина\n\'\'\'Волшебник\'\'\' — Андрей Матвеев\n\n[[photo-35124177_358607288|450x321px| ]]\n\n\n\'\'\'[http://www.zazerkal.spb.ru/tickets/1657.htm|КУПИТЬ БИЛЕТ]\'\'\'',0,27,'Незнайка',11,2025,'2025-10-09 14:42:48','2025-11-08 01:36:56','Приключения_Незнайки_15.11.25'),
(15,'620c3de6-4fb4-4a40-810c-ab417d3a5989','2025-11-15','15:00:00','Спящая красавица','спящая красавица','Для всей семьи','1666','https://www.zazerkal.spb.ru/tickets/1666.htm','https://www.zazerkal.spb.ru/repertoire/product205.htm','https://www.zazerkal.spb.ru/images/data/repertoire/205_small_1729624443.jpg','==В ролях:==\n\'\'\'Он\'\'\' — Кирилл Корсаков\n\'\'\'Она\'\'\' — Анастасия Солари\n\'\'\'Её мама/Колдунья\'\'\' — Елена Терновая\n\'\'\'Дворецкий\'\'\' — Никита Светлов\n\'\'\'Горничная\'\'\' — Евгения Терновцева\n\n[[photo-35124177_328157264|450x300px| ]]\n\n\'\'\'Концертмейстер\'\'\' — Анна Коротаева\n\n\n\'\'\'[http://www.zazerkal.spb.ru/tickets/1666.htm|КУПИТЬ БИЛЕТ]\'\'\'',0,22,'Спящая',11,2025,'2025-10-09 14:42:48','2025-11-08 01:42:04','Спящая_красавица_15.11.25'),
(16,'620c3de6-4fb4-4a40-810c-ab417d3a5989','2025-11-15','19:00:00','Иоланта','иоланта','Для всей семьи','1656','https://www.zazerkal.spb.ru/tickets/1656.htm','https://www.zazerkal.spb.ru/repertoire/product371.htm','https://www.zazerkal.spb.ru/images/data/repertoire/371_small_1731357419.jpg','==В ролях==\n\'\'\'Иоланта\'\'\' — Ольга Черемных\n\'\'\'Рене, король Прованса, её отец\'\'\' — Алексей Сазонов\n\'\'\'Эбн-Хакиа, врач\'\'\' — Марат Мухаметзянов\n\'\'\'Роберт, герцог Бургундский\'\'\' — Иван Васильев\n\'\'\'Водемон, граф Бургундский\'\'\' — Симеон Асеев (\'\'впервые в роли\'\')\n\'\'\'Альмерик, оруженосец короля\'\'\' — Никита Козулин (\'\'впервые в роли\'\')\n\'\'\'Бертран, привратник\'\'\' — Иван Красавцев\n\'\'\'Марта, его жена, кормилица Иоланты\'\'\' — Екатерина Курбанова\n\'\'\'Бригитта, подруга Иоланты\'\'\' — Ольга Васильева\n\'\'\'Лаура, подруга Иоланты\'\'\' — Дарья Росицкая\n\'\'\'Дзанни\'\'\' — Антон Хомяков, Артём Мисаженков, Андрей Михеев\n\n[[photo-35124177_387285130|450x337px| ]]\n\n\'\'\'Дирижёр\'\'\' — Пётр Максимов\n\n\n\'\'\'[http://www.zazerkal.spb.ru/tickets/1656.htm|КУПИТЬ БИЛЕТ]\'\'\'',0,55,'Иоланта',11,2025,'2025-10-09 14:42:48','2025-11-08 01:44:26','Иоланта_15.11.25'),
(17,'620c3de6-4fb4-4a40-810c-ab417d3a5989','2025-11-16','12:00:00','Абонемент № 1. Театральный уикенд','абонемент 1 театральный уикенд','Для всей семьи','1583','https://www.zazerkal.spb.ru/tickets/1583.htm','https://www.zazerkal.spb.ru/repertoire/product395.htm','https://www.zazerkal.spb.ru/images/img/plug.jpg','==В ролях:==\n\'\'\'Хоттабыч\'\'\' — Сергей Алёшин\n\'\'\'Волька\'\'\' — Артём Мисаженков\n\'\'\'Женька\'\'\' — Елизавета Алексеева\n\'\'\'Омар; Михаил Исаевич\'\'\', врач скорой помощи — Сергей Ермолаев\n\'\'\'Алевтина\'\'\', пионервожатая — Надежда Антюфеева\n\'\'\'Сергей Семёнович\'\'\', учитель географии — Кирилл Костромин\n\'\'\'Сидоров,\'\'\' старший лейтенант; \'\'\'Дамир Амирович\'\'\', продавец — Андрей Удалов\n\'\'\'Сержант Смирнова\'\'\' — Любовь Голубева\n\'\'\'Сулейман-ибн-Дауд\'\'\' и \'\'\'Пантелеймон Кузьмич\'\'\' — Марат Мухаметзянов\n\'\'\'Сотрудницы сберкассы\'\'\' — Елена Понятовская, Юлия Андрушкевич, Анна Дарьянова\n\'\'\'Наталья Кузьминична Пилюкина\'\'\' — Елена Терновая\n\'\'\'Гога Пилюкин\'\'\' — Сергей Поваляев\n\'\'\'Москвички\'\'\' — Полина Ульянова, Вероника Ищенко, Анастасия Янюшкина, Анна Григорьева\n\'\'\'Водолазы\'\'\' — Сергей Ваганов, Кирилл Корсаков, Павел Сопов\n\'\'\'Пионеры, людоеды, ифриты, футболисты\'\'\' — Никита Хвостов, Антон Хомяков, Максим Савватеев, Максим Левин, Юрий Васильев\n\'\'\'Пионерки\'\'\' — Анастасия Солари, Полина Поляцкая, Екатерина Агафонова, Ольга Шокель, Анна Щербакова\n\n[[photo-35124177_457239607|450x300px| ]]\n\n\n\'\'\'[http://www.zazerkal.spb.ru/tickets/1583.htm|КУПИТЬ БИЛЕТ]\'\'\'',0,14,'Хоттабыч',11,2025,'2025-10-09 14:42:48','2025-11-08 01:47:31','Старик_Хоттабыч_16.11.25'),
(18,'620c3de6-4fb4-4a40-810c-ab417d3a5989','2025-11-16','19:00:00','Золушка','золушка','Для взрослых','1655','https://www.zazerkal.spb.ru/tickets/1655.htm','https://www.zazerkal.spb.ru/repertoire/product170.htm','https://www.zazerkal.spb.ru/images/data/repertoire/170_small_1727895308.jpg','==В ролях:==\n\'\'\'Золушка\'\'\' — Валентина Непряхина (\'\'впервые в роли\'\')\n\'\'\'Принц Рамиро\'\'\' — Дамир Закиров\n\'\'\'Дон Маньифико\'\'\' — Алексей Сазонов\n\'\'\'Клоринда\'\'\' — Ольга Васильева\n\'\'\'Тисбе\'\'\' — Екатерина Курбанова\n\'\'\'Дандини\'\'\' — Иван Васильев\n\'\'\'Алидоро\'\'\' — Владимир Целебровский (\'\'впервые в роли\'\')\n\'\'\'Арапчата\'\'\' — Екатерина Ефимова, Любовь Голубева\n\'\'\'За клавесином\'\'\' — Егор Прокопьев\n\n[[photo-35124177_333138319|400x266px| ]]\n\n\'\'\'Дирижёр\'\'\' — Павел Бубельников\n\n\n\'\'\'[http://www.zazerkal.spb.ru/tickets/1655.htm|КУПИТЬ БИЛЕТ]\'\'\'',0,54,'Золушка',11,2025,'2025-10-09 14:42:48','2025-11-07 22:19:55','Золушка_16.11.25'),
(19,'620c3de6-4fb4-4a40-810c-ab417d3a5989','2025-11-21','11:00:00','Абонемент № 3. С друзьями в «Зазеркалье»!','абонемент 3 с друзьями в зазеркалье','Для всей семьи','1587','https://www.zazerkal.spb.ru/tickets/1587.htm','https://www.zazerkal.spb.ru/repertoire/product296.htm','https://www.zazerkal.spb.ru/images/img/plug.jpg','==В ролях:==\n\'\'\'Хоттабыч\'\'\' — Сергей Алёшин\n\'\'\'Волька\'\'\' — Артём Мисаженков\n\'\'\'Женька\'\'\' — Елизавета Алексеева\n\'\'\'Омар; Михаил Исаевич\'\'\', врач скорой помощи — Сергей Ермолаев\n\'\'\'Алевтина\'\'\', пионервожатая — Надежда Антюфеева\n\'\'\'Сергей Семёнович\'\'\', учитель географии — Николай Сысак\n\'\'\'Сидоров,\'\'\' старший лейтенант; \'\'\'Дамир Амирович\'\'\', продавец — Андрей Удалов\n\'\'\'Сержант Смирнова\'\'\' — Любовь Голубева\n\'\'\'Сулейман-ибн-Дауд\'\'\' и \'\'\'Пантелеймон Кузьмич\'\'\' — Марат Мухаметзянов\n\'\'\'Сотрудницы сберкассы\'\'\' — Елена Понятовская, Евгения Испавская, Анна Дарьянова\n\'\'\'Наталья Кузьминична Пилюкина\'\'\' — Елена Терновая\n\'\'\'Гога Пилюкин\'\'\' — Сергей Поваляев\n\'\'\'Москвички\'\'\' — Полина Ульянова, Вероника Ищенко, Анастасия Янюшкина, Анна Григорьева\n\'\'\'Водолазы\'\'\' — Сергей Ваганов, Кирилл Корсаков, Павел Сопов\n\'\'\'Пионеры, людоеды, ифриты, футболисты\'\'\' — Андрей Михеев, Антон Хомяков, Максим Савватеев, Максим Левин, Юрий Васильев\n\'\'\'Пионерки\'\'\' — Анастасия Солари, Полина Поляцкая, Екатерина Агафонова, Ольга Шокель, Анна Щербакова\n\n[[photo-35124177_457239607|450x300px| ]]\n\n\n\'\'\'[http://www.zazerkal.spb.ru/tickets/1587.htm|КУПИТЬ БИЛЕТ]\'\'\'',0,14,'Хоттабыч',11,2025,'2025-10-09 14:42:48','2025-11-08 01:50:20','Старик_Хоттабыч_21.11.25'),
(20,'620c3de6-4fb4-4a40-810c-ab417d3a5989','2025-11-21','19:00:00','Игра в классики','игра в классики','Для взрослых','1669','https://www.zazerkal.spb.ru/tickets/1669.htm','https://www.zazerkal.spb.ru/repertoire/product518.htm','https://www.zazerkal.spb.ru/images/data/repertoire/518_small_1757077370.jpeg','==В ролях:==\n\'\'\'Орасио Оливейра\'\'\' — Кирилл Павлов\n\'\'\'Мага Лусиа\'\'\' — Мария Мукупа\n\'\'\'Осип\'\'\' — Кирилл Корсаков\n\'\'\'Этьен\'\'\' — Дмитрий Фёдоров\n\'\'\'Рональд\'\'\' — Евгений Кузнецов\n\'\'\'Бэпс\'\'\' — Елизавета Майданова\n\'\'\'Жандарм Жан\'\'\' — Иван Красавцев\n\'\'\'Перико\'\'\' — Андрей Матвеев\n\'\'\'Звёзды кабаре\'\'\' — Сауле Искакова, Анна Снегова, Анна Григорьева\n\'\'\'Официантки\'\'\' — Полина Ульянова, Ярослава Раильтянина, Анна Кочетова\n\n[[photo-35124177_457239816|400x267px| ]]\n\n\'\'\'Дирижёр\'\'\' — Егор Прокопьев\n\n\'\'\'[http://www.zazerkal.spb.ru/tickets/1669.htm|КУПИТЬ БИЛЕТ]\'\'\'',0,11,'Вайль',11,2025,'2025-10-09 14:42:48','2025-11-08 03:55:39','Курт_Вайль._Игра_в_классики_21.11.25'),
(21,'620c3de6-4fb4-4a40-810c-ab417d3a5989','2025-11-22','12:00:00','Что случилось в пятом \"Б\"','что случилось в пятом б','Для всей семьи','1670','https://www.zazerkal.spb.ru/tickets/1670.htm','https://www.zazerkal.spb.ru/repertoire/product302.htm','https://www.zazerkal.spb.ru/images/data/repertoire/302_small_1680697031.jpg','==В ролях:==\n\'\'\'Касьян Серафимович\'\'\', учитель биологии — Иван Красавцев\n\'\'\'Семён Семёнович\'\'\', учитель пения — Евгений Кузнецов\n\'\'\'Алла Романовна\'\'\', учительница английского — Анна Григорьева\n\'\'\'Смирнов\'\'\' — Антон Хомяков\n\'\'\'Спицина\'\'\' — Елизавета Алексеева\n\'\'\'Торопыгина\'\'\' — Елизавета Майданова\n\'\'\'Петя Душнов\'\'\' — Дмитрий Фёдоров\n\n====Обитатели живого уголка:====\n\'\'\'Питон\'\'\' — Дмитрий Фёдоров\n\'\'\'Попугаи\'\'\' — Семён Фатыхов, Настасья Янюшкина\n\'\'\'Тритон\'\'\' — Софья Шех\n\'\'\'Курица Клуха\'\'\' — Дарья Косенко-Вишневецкая\n\n\'\'\'Валентина Прокопьевна\'\'\', учительница русского — Настасья Янюшкина\n\'\'\'Толя Мехнов\'\'\' — Артём Мисаженков\n\'\'\'Мама Толи\'\'\' — Екатерина Каурова\n\'\'\'Пончик\'\'\' — Никита Хвостов\n\'\'\'Зинка\'\'\', его сестра — Елизавета Майданова\n\'\'\'Тётя Феня\'\'\', повариха — Анна Григорьева\n\'\'\'Доктор\'\'\' — Иван Красавцев\n\'\'\'Пожарный\'\'\' — Евгений Кузнецов\n\n\'\'\'Ученики пятого «Б»\'\'\' — артисты театра\n\n[[photo-35124177_457239721|400x267px| ]]\n\n\n\'\'\'[http://www.zazerkal.spb.ru/tickets/1670.htm|КУПИТЬ БИЛЕТ]\'\'\'',0,29,'5б',11,2025,'2025-10-09 14:42:48','2025-11-08 15:16:31','Что_случилось_в_5_«Б»_22.11.25_12'),
(22,'620c3de6-4fb4-4a40-810c-ab417d3a5989','2025-11-22','15:00:00','Что случилось в пятом \"Б\"','что случилось в пятом б','Для всей семьи','1668','https://www.zazerkal.spb.ru/tickets/1668.htm','https://www.zazerkal.spb.ru/repertoire/product302.htm','https://www.zazerkal.spb.ru/images/data/repertoire/302_small_1680697031.jpg','==В ролях:==\n\'\'\'Касьян Серафимович\'\'\', учитель биологии — Иван Красавцев\n\'\'\'Семён Семёнович\'\'\', учитель пения — Евгений Кузнецов\n\'\'\'Алла Романовна\'\'\', учительница английского — Анна Григорьева\n\'\'\'Смирнов\'\'\' — Антон Хомяков\n\'\'\'Спицина\'\'\' — Елизавета Алексеева\n\'\'\'Торопыгина\'\'\' — Елизавета Майданова\n\'\'\'Петя Душнов\'\'\' — Дмитрий Фёдоров\n\n====Обитатели живого уголка:====\n\'\'\'Питон\'\'\' — Дмитрий Фёдоров\n\'\'\'Попугаи\'\'\' — Семён Фатыхов, Настасья Янюшкина\n\'\'\'Тритон\'\'\' — Софья Шех\n\'\'\'Курица Клуха\'\'\' — Дарья Косенко-Вишневецкая\n\n\'\'\'Валентина Прокопьевна\'\'\', учительница русского — Настасья Янюшкина\n\'\'\'Толя Мехнов\'\'\' — Артём Мисаженков\n\'\'\'Мама Толи\'\'\' — Екатерина Каурова\n\'\'\'Пончик\'\'\' — Никита Хвостов\n\'\'\'Зинка\'\'\', его сестра — Елизавета Майданова\n\'\'\'Тётя Феня\'\'\', повариха — Анна Григорьева\n\'\'\'Доктор\'\'\' — Иван Красавцев\n\'\'\'Пожарный\'\'\' — Евгений Кузнецов\n\n\'\'\'Ученики пятого «Б»\'\'\' — артисты театра\n\n[[photo-35124177_457239721|400x267px| ]]\n\n\n\'\'\'[http://www.zazerkal.spb.ru/tickets/1668.htm|КУПИТЬ БИЛЕТ]\'\'\'',0,29,'5б',11,2025,'2025-10-09 14:42:48','2025-11-08 15:17:04','Что_случилось_в_5_«Б»_22.11.25_15'),
(23,'620c3de6-4fb4-4a40-810c-ab417d3a5989','2025-11-22','19:00:00','Игра в классики','игра в классики','Для взрослых','1667','https://www.zazerkal.spb.ru/tickets/1667.htm','https://www.zazerkal.spb.ru/repertoire/product518.htm','https://www.zazerkal.spb.ru/images/data/repertoire/518_small_1757077370.jpeg','==В ролях:==\n\'\'\'Орасио Оливейра\'\'\' — Максим Левин\n\'\'\'Мага Лусиа\'\'\' — Татьяна Закирова\n\'\'\'Осип\'\'\' — Семён Фатыхов\n\'\'\'Этьен\'\'\' — Сергей Ваганов\n\'\'\'Рональд\'\'\' — Никита Козулин\n\'\'\'Бэпс\'\'\' — Анна Щербакова\n\'\'\'Жандарм Жан\'\'\' — Иван Красавцев\n\'\'\'Перико\'\'\' — Николай Сысак\n\'\'\'Звёзды кабаре\'\'\' — Анна Снегова, Сауле Искакова, Анна Григорьева\n\'\'\'Официантки\'\'\' — Настасья Янюшкина, Ольга Шокель, Екатерина Каурова\n\n[[photo-35124177_457239816|400x267px| ]]\n\n\'\'\'Дирижёр\'\'\' — Егор Прокопьев\n\n\'\'\'[http://www.zazerkal.spb.ru/tickets/1667.htm|КУПИТЬ БИЛЕТ]\'\'\'',0,11,'Вайль',11,2025,'2025-10-09 14:42:48','2025-11-08 03:56:17','Курт_Вайль._Игра_в_классики_22.11.25'),
(24,'620c3de6-4fb4-4a40-810c-ab417d3a5989','2025-11-23','12:00:00','Сказание о Рикки-Тикки-Тави в девятнадцати песнях','сказание о рикки тикки тави в девятнадцати песнях','Для всей семьи','1653','https://www.zazerkal.spb.ru/tickets/1653.htm','https://www.zazerkal.spb.ru/repertoire/product163.htm','https://www.zazerkal.spb.ru/images/data/repertoire/163_small_1729078320.jpg',NULL,0,21,'Рикки',11,2025,'2025-10-09 14:42:48','2025-11-07 22:15:07','Сказание_о_Рикки-Тикки-Тави_23.11.25'),
(25,'620c3de6-4fb4-4a40-810c-ab417d3a5989','2025-11-23','15:00:00','Три поросенка','три поросенка','Для детей','1671','https://www.zazerkal.spb.ru/tickets/1671.htm','https://www.zazerkal.spb.ru/repertoire/product164.htm','https://www.zazerkal.spb.ru/images/data/repertoire/164_small_1727892096.jpg',NULL,0,8,'Свиньи',11,2025,'2025-10-09 14:42:48','2025-11-07 22:15:07','Три_поросёнка_23.11.25'),
(26,'620c3de6-4fb4-4a40-810c-ab417d3a5989','2025-11-23','19:00:00','Детский альбом','детский альбом','Для всей семьи','1659','https://www.zazerkal.spb.ru/tickets/1659.htm','https://www.zazerkal.spb.ru/repertoire/product167.htm','https://www.zazerkal.spb.ru/images/data/repertoire/167_small_1729079909.jpg',NULL,0,15,'Альбом',11,2025,'2025-10-09 14:42:48','2025-11-07 22:15:07','Детский_альбом_23.11.25'),
(27,'620c3de6-4fb4-4a40-810c-ab417d3a5989','2025-11-27','11:00:00','Абонемент № 6. Мы идём в театр!','абонемент 6 мы идём в театр','Для всей семьи','1601','https://www.zazerkal.spb.ru/tickets/1601.htm','https://www.zazerkal.spb.ru/repertoire/product517.htm','https://www.zazerkal.spb.ru/images/img/plug.jpg',NULL,0,7,'Клык',11,2025,'2025-10-09 14:42:48','2025-11-07 22:15:07','Белый_Клык_27.11.25'),
(28,'620c3de6-4fb4-4a40-810c-ab417d3a5989','2025-11-28','11:00:00','Абонемент № 4. Мы идём в театр!','абонемент 4 мы идём в театр','Для всей семьи','1584','https://www.zazerkal.spb.ru/tickets/1584.htm','https://www.zazerkal.spb.ru/repertoire/product352.htm','https://www.zazerkal.spb.ru/images/img/plug.jpg',NULL,0,7,'Клык',11,2025,'2025-10-09 14:42:48','2025-11-07 22:15:07','Белый_Клык_28.11.25'),
(29,'620c3de6-4fb4-4a40-810c-ab417d3a5989','2025-11-28','19:00:00','Евгений Онегин','евгений онегин','Для всей семьи','1660','https://www.zazerkal.spb.ru/tickets/1660.htm','https://www.zazerkal.spb.ru/repertoire/product197.htm','https://www.zazerkal.spb.ru/images/data/repertoire/197_small_1729006647.jpg',NULL,0,17,'Онегин',11,2025,'2025-10-09 14:42:48','2025-11-07 22:15:07','Евгений_Онегин_28.11.25'),
(30,'620c3de6-4fb4-4a40-810c-ab417d3a5989','2025-11-29','12:00:00','Дюймовочка','дюймовочка','Для детей','1658','https://www.zazerkal.spb.ru/tickets/1658.htm','https://www.zazerkal.spb.ru/repertoire/product229.htm','https://www.zazerkal.spb.ru/images/data/repertoire/229_small_1729097058.jpg',NULL,0,44,'Дюймовочка',11,2025,'2025-10-09 14:42:48','2025-11-07 22:15:07','Дюймовочка_29.11.25'),
(31,'620c3de6-4fb4-4a40-810c-ab417d3a5989','2025-11-29','15:00:00','Крокодил','крокодил','Для всей семьи','1674','https://www.zazerkal.spb.ru/tickets/1674.htm','https://www.zazerkal.spb.ru/repertoire/product230.htm','https://www.zazerkal.spb.ru/images/data/repertoire/230_small_1733324912.jpg',NULL,0,16,'Крокодил',11,2025,'2025-10-09 14:42:48','2025-11-07 22:15:07','Крокодил_29.11.25'),
(32,'620c3de6-4fb4-4a40-810c-ab417d3a5989','2025-11-29','19:00:00','Царская невеста','царская невеста','Для взрослых','1661','https://www.zazerkal.spb.ru/tickets/1661.htm','https://www.zazerkal.spb.ru/repertoire/product192.htm','https://www.zazerkal.spb.ru/images/data/repertoire/192_small_1729079417.jpg',NULL,0,50,'Царская',11,2025,'2025-10-09 14:42:48','2025-11-07 22:15:07','Царская_невеста_29.11.25'),
(33,'620c3de6-4fb4-4a40-810c-ab417d3a5989','2025-11-30','12:00:00','Мишкина каша','мишкина каша','Для всей семьи','1673','https://www.zazerkal.spb.ru/tickets/1673.htm','https://www.zazerkal.spb.ru/repertoire/product481.htm','https://www.zazerkal.spb.ru/images/data/repertoire/481_small_1746126550.jpg',NULL,0,19,'Каша',11,2025,'2025-10-09 14:42:48','2025-11-07 22:15:07','Мишкина_каша_30.11.25_12'),
(34,'620c3de6-4fb4-4a40-810c-ab417d3a5989','2025-11-30','15:00:00','Мишкина каша','мишкина каша','Для всей семьи','1672','https://www.zazerkal.spb.ru/tickets/1672.htm','https://www.zazerkal.spb.ru/repertoire/product481.htm','https://www.zazerkal.spb.ru/images/data/repertoire/481_small_1746126550.jpg',NULL,0,19,'Каша',11,2025,'2025-10-09 14:42:48','2025-11-07 22:15:07','Мишкина_каша_30.11.25_15'),
(35,'620c3de6-4fb4-4a40-810c-ab417d3a5989','2025-11-30','19:00:00','Любовный напиток','любовный напиток','Для взрослых','1662','https://www.zazerkal.spb.ru/tickets/1662.htm','https://www.zazerkal.spb.ru/repertoire/product162.htm','https://www.zazerkal.spb.ru/images/data/repertoire/162_small_1732876877.jpeg',NULL,0,23,'Любовный',11,2025,'2025-10-09 14:42:48','2025-11-07 22:15:07','Любовный_напиток_30.11.25'),
(36,'8f5d7588-1598-4065-8213-f8817592f62f','2025-10-17','19:00:00','Военные письма','военные письма','Для всей семьи','1616','https://www.zazerkal.spb.ru/tickets/1616.htm','https://www.zazerkal.spb.ru/repertoire/product497.htm','https://www.zazerkal.spb.ru/images/data/repertoire/497_small_1746130393.jpg','==В ролях:==\n\'\'\'Что мои-то ясны очи\'\'\' — Алексей Сазонов\n\'\'\'Дождь дождит\'\'\' — Анна Евтушенко (впервые в роли)\n\'\'\'Весело на душе\'\'\' — ансамбль\n\'\'\'Дразнилка\'\'\' — детский хор\n\'\'\'Лихо\'\'\' — Андрей Удалов\n\'\'\'Рябины\'\'\' — Екатерина Ефимова, Сергей Алёшин\n\'\'\'Дорогой, куда ты едешь\'\'\' — Елизавета Алексеева, Дмитрий Фёдоров\n\'\'\'Посиделки\'\'\' — Людмила Окель, ансамбль\n\'\'\'Вечерняя музыка\'\'\' — Анна Кочетова, ансамбль\n\'\'\'Скажи, скажи, голубчик\'\'\' — Екатерина Агафонова, Симеон Асеев\n\'\'\'Пошёл солдат\'\'\' — Кирилл Корсаков, Никита Козулин, Семён Фатыхов\n\'\'\'Милый мой дружок\'\'\' — Елизавета Майданова, Семён Фатыхов\n\'\'\'Почтальонка\'\'\' — Анна Смирнова\n\'\'\'Молитва\'\'\' — Сергей Ваганов\n\'\'\'Письмо\'\'\' — Алексей Сазонов\n\'\'\'Военные письма\'\'\' — оркестр\n\'\'\'Май зелёный\'\'\' — детский хор\n\'\'\'Дирижёр\'\'\' — Пётр Максимов\n\n\'\'\'[http://www.zazerkal.spb.ru/tickets/1616.htm|КУПИТЬ БИЛЕТ]\'\'\'',0,18,'Письма',10,2025,'2025-10-14 01:16:20','2025-10-14 15:37:06',NULL),
(37,'8f5d7588-1598-4065-8213-f8817592f62f','2025-10-18','12:00:00','Мишкина каша','мишкина каша','Для всей семьи','1636','https://www.zazerkal.spb.ru/tickets/1636.htm','https://www.zazerkal.spb.ru/repertoire/product481.htm','https://www.zazerkal.spb.ru/images/data/repertoire/481_small_1746126550.jpg','==В ролях:==\n\'\'\'Мишка\'\'\' — Антон Хомяков\n\'\'\'Валька\'\'\' — Артём Мисаженков\n\'\'\'Мама Мишки\'\'\' — Юлия Андрушкевич\n\'\'\'Мама Вальки\'\'\' — Мария Мукупа\n\'\'\'Сторож\'\'\' — Кирилл Павлов\n\'\'\'Каша\'\'\' — Кирилл Павлов\n\'\'\'Ирка\'\'\' — Полина Ульянова\n\'\'\'Экскурсовод\'\'\' — Екатерина Агафонова\n\'\'\'Огурчики\'\'\' — Полина Ульянова, Екатерина Агафонова, Кирилл Корсаков\n\'\'\'Лимонад «Дюшес»\'\'\' — Никита Хвостов\n\'\'\'Сом\'\'\' — Кирилл Корсаков\n\'\'\'Окунь\'\'\' — Никита Хвостов\n\'\'\'Пиранья\'\'\' — Екатерина Агафонова\n\'\'\'Крокодил\'\'\' — Полина Ульянова\n\n\'\'\'[http://www.zazerkal.spb.ru/tickets/1636.htm|КУПИТЬ БИЛЕТ]\'\'\'',0,19,'Каша',10,2025,'2025-10-14 01:16:20','2025-10-14 15:58:17',NULL),
(38,'8f5d7588-1598-4065-8213-f8817592f62f','2025-10-18','15:00:00','Синяя птица','синяя птица','Для всей семьи','1617','https://www.zazerkal.spb.ru/tickets/1617.htm','https://www.zazerkal.spb.ru/repertoire/product328.htm','https://www.zazerkal.spb.ru/images/data/repertoire/328_small_1733326862.jpg','==В ролях:==\n\'\'\'Тильтиль\'\'\' — Дмитрий Фёдоров\n\'\'\'Митиль\'\'\' — Елизавета Майданова\n\'\'\'Мать\'\'\' — Татьяна Закирова (\'\'впервые в роли\'\')\n\'\'\'Господин Светеборг\'\'\' / \'\'\'Волшебник Свет\'\'\' — Антон Авдеев\n\'\'\'Внучка\'\'\' — Настасья Янюшкина\n\'\'\'Кошка Тилетта\'\'\' — Мария Мукупа\n\'\'\'Пёс Тило\'\'\' — Семён Фатыхов\n\'\'\'Сахар\'\'\' — Николай Сысак\n\'\'\'Хлеб\'\'\' — Сергей Ваганов\n\'\'\'Молоко\'\'\' — Людмила Окель\n\'\'\'Бабушка\'\'\' — Елена Терновая\n\'\'\'Дедушка\'\'\' — Андрей Матвеев\n\'\'\'Ночь\'\'\' — Анна Снегова\n\'\'\'Ворон\'\'\' — Юрий Васильев\n\'\'\'Дуб\'\'\' — Иван Красавцев\n\'\'\'Липа\'\'\' — Екатерина Каурова\n\'\'\'Ива\'\'\' — Анна Григорьева\n\'\'\'Берёза\'\'\' — Ярослава Раильтянина\n\'\'\'Плющ\'\'\' — Дарья Косенко-Вишневецкая\n\'\'\'Волк\'\'\' — Юрий Васильев\n\'\'\'Медведь\'\'\' — Владислав Климов\n\'\'\'Зубр\'\'\' — Сергей Поваляев\n\'\'\'Полное Наслаждение\'\'\' — Александр Подмешальский\n\'\'\'Менее полное Наслаждение\'\'\' — Андрей Матвеев\n\'\'\'Сладость\'\'\' — Елена Терновая\n\'\'\'Старец Время\'\'\' — Андрей Удалов\n\n[[photo-35124177_457239776|400x267px| ]]\n\n\'\'\'Дирижёр\'\'\' — Артур Ераносов\n\n\n\'\'\'[http://www.zazerkal.spb.ru/tickets/1617.htm|КУПИТЬ БИЛЕТ]\'\'\'',0,4,'СП',10,2025,'2025-10-14 01:16:20','2025-11-08 14:34:56',NULL),
(39,'8f5d7588-1598-4065-8213-f8817592f62f','2025-10-18','19:00:00','Синяя птица','синяя птица','Для всей семьи','1626','https://www.zazerkal.spb.ru/tickets/1626.htm','https://www.zazerkal.spb.ru/repertoire/product328.htm','https://www.zazerkal.spb.ru/images/data/repertoire/328_small_1733326862.jpg','==В ролях:==\n\'\'\'Тильтиль\'\'\' — Дмитрий Фёдоров\n\'\'\'Митиль\'\'\' — Елизавета Майданова\n\'\'\'Мать\'\'\' — Татьяна Закирова\n\'\'\'Господин Светеборг\'\'\' / \'\'\'Волшебник Свет\'\'\' — Альберт Асадуллин\n\'\'\'Внучка\'\'\' — Настасья Янюшкина\n\'\'\'Кошка Тилетта\'\'\' — Мария Мукупа\n\'\'\'Пёс Тило\'\'\' — Семён Фатыхов\n\'\'\'Сахар\'\'\' — Николай Сысак\n\'\'\'Хлеб\'\'\' — Сергей Ваганов\n\'\'\'Молоко\'\'\' — Людмила Окель\n\'\'\'Бабушка\'\'\' — Елена Терновая\n\'\'\'Дедушка\'\'\' — Андрей Матвеев\n\'\'\'Ночь\'\'\' — Анна Снегова\n\'\'\'Ворон\'\'\' — Юрий Васильев\n\'\'\'Дуб\'\'\' — Иван Красавцев\n\'\'\'Липа\'\'\' — Екатерина Каурова\n\'\'\'Ива\'\'\' — Анна Григорьева\n\'\'\'Берёза\'\'\' — Ярослава Раильтянина\n\'\'\'Плющ\'\'\' — Дарья Косенко-Вишневецкая\n\'\'\'Волк\'\'\' — Юрий Васильев\n\'\'\'Медведь\'\'\' — Владислав Климов\n\'\'\'Зубр\'\'\' — Сергей Поваляев\n\'\'\'Полное Наслаждение\'\'\' — Александр Подмешальский\n\'\'\'Менее полное Наслаждение\'\'\' — Андрей Матвеев\n\'\'\'Сладость\'\'\' — Елена Терновая\n\'\'\'Старец Время\'\'\' — Андрей Удалов\n\n[[photo-35124177_457239776|400x267px| ]]\n\n\'\'\'Дирижёр\'\'\' — Артур Ераносов\n\n\n\'\'\'[http://www.zazerkal.spb.ru/tickets/1626.htm|КУПИТЬ БИЛЕТ]\'\'\'',0,4,'СП',10,2025,'2025-10-14 01:16:20','2025-11-08 14:36:02',NULL),
(40,'8f5d7588-1598-4065-8213-f8817592f62f','2025-10-19','15:00:00','Абонемент № 5. Три апельсина','абонемент 5 три апельсина','Для всей семьи','1585','https://www.zazerkal.spb.ru/tickets/1585.htm','https://www.zazerkal.spb.ru/repertoire/product300.htm','https://www.zazerkal.spb.ru/images/data/repertoire/300_small_1727899489.jpg','==В ролях:==\n\'\'СОСТАВ УТОЧНЯЕТСЯ\'\'\n\n\'\'\'[http://www.zazerkal.spb.ru/tickets/1585.htm|КУПИТЬ БИЛЕТ]\'\'\'',0,10,'Апельсины',10,2025,'2025-10-14 01:16:20','2025-10-14 01:16:20',NULL),
(41,'8f5d7588-1598-4065-8213-f8817592f62f','2025-10-19','19:00:00','Пиковая дама','пиковая дама','Для взрослых','1627','https://www.zazerkal.spb.ru/tickets/1627.htm','https://www.zazerkal.spb.ru/repertoire/product299.htm','https://www.zazerkal.spb.ru/images/data/repertoire/299_small_1680697487.jpg','==В ролях:==\n\'\'\'Герман\'\'\', офицер — Дмитрий Каляка\n\'\'\'Лиза\'\'\', внучка графини — Елена Миляева\n\'\'\'Томский\'\'\', граф, друг Германа, внук графини — Марат Мухаметзянов\n\'\'\'Елецкий\'\'\', жених Лизы — Иван Васильев\n\'\'\'Графиня\'\'\' — Екатерина Курбанова\n\'\'\'Полина\'\'\', подруга Лизы — Анна Старцева\n\'\'\'Чекалинский\'\'\', офицер — Максим Левин\n\'\'\'Сурин\'\'\', офицер — Семён Фатыхов\n\'\'\'Чаплицкий\'\'\' — Николай Сысак\n\'\'\'Нарумов\'\'\' — Андрей Михеев\n\'\'\'Маша\'\'\', горничная — Людмила Окель\n\'\'\'Гувернантка\'\'\' — Анна Дарьянова\n\'\'\'Распорядитель\'\'\' — Юрий Васильев\n\'\'\'Графиня в молодости\'\'\' — Вероника Ищенко\n\n===Пастораль «Искренность пастушки»===\n\'\'\'Прилепа\'\'\' — Екатерина Ефимова\n\'\'\'Миловзор\'\'\' — Анна Старцева\n\'\'\'Златогор\'\'\' — Марат Мухаметзянов\n\n\'\'\'Пушкин\'\'\' — Артём Мисаженков, Евгений Кузнецов, Никита Хвостов, Антон Хомяков\n\n[[photo-35124177_457239759|400x267px| ]]\n\n\'\'\'Дирижёр\'\'\' — Анатолий Рыбалко\n\n\n\'\'\'[http://www.zazerkal.spb.ru/tickets/1627.htm|КУПИТЬ БИЛЕТ]\'\'\'',0,20,'Пиковая',10,2025,'2025-10-14 01:16:20','2025-11-08 14:39:55',NULL),
(42,'8f5d7588-1598-4065-8213-f8817592f62f','2025-10-25','12:00:00','Сказание о Рикки-Тикки-Тави в девятнадцати песнях','сказание о рикки тикки тави в девятнадцати песнях','Для всей семьи','1621','https://www.zazerkal.spb.ru/tickets/1621.htm','https://www.zazerkal.spb.ru/repertoire/product163.htm','https://www.zazerkal.spb.ru/images/data/repertoire/163_small_1729078320.jpg','==В ролях:==\n\'\'\'Рикки\'\'\' — Никита Хвостов\n\'\'\'Мама\'\'\' — Юлия Андрушкевич\n\'\'\'Папа\'\'\' — Кирилл Корсаков\n\'\'\'Тедди\'\'\' — Анастасия Солари\n\'\'\'Наг\'\'\' — Андрей Михеев\n\'\'\'Нагайна\'\'\' — Любовь Голубева\n\'\'\'Дарзи\'\'\' — Сергей Ермолаев\n\'\'\'Тирзи\'\'\' — Виктория Романова\n\'\'\'Чучундра\'\'\' — Екатерина Огнева\n\n[[photo-35124177_280978405|450x300px| ]]\n\n\n\'\'\'[http://www.zazerkal.spb.ru/tickets/1621.htm|КУПИТЬ БИЛЕТ]\'\'\'',0,21,'Рикки',10,2025,'2025-10-14 01:16:20','2025-11-08 14:36:52',NULL),
(43,'8f5d7588-1598-4065-8213-f8817592f62f','2025-10-25','15:00:00','Спящая красавица','спящая красавица','Для всей семьи','1640','https://www.zazerkal.spb.ru/tickets/1640.htm','https://www.zazerkal.spb.ru/repertoire/product205.htm','https://www.zazerkal.spb.ru/images/data/repertoire/205_small_1729624443.jpg','==В ролях:==\n\'\'\'Он\'\'\' — Андрей Михеев\n\'\'\'Она\'\'\' — Анастасия Ряполова\n\'\'\'Её мама/Колдунья\'\'\' — Елена Терновая\n\'\'\'Дворецкий\'\'\' — Никита Светлов\n\'\'\'Горничная\'\'\' — Евгения Терновцева\n\'\'\'Концертмейстер\'\'\' — Анна Коротаева\n\n\'\'\'[http://www.zazerkal.spb.ru/tickets/1640.htm|КУПИТЬ БИЛЕТ]\'\'\'',0,22,'Спящая',10,2025,'2025-10-14 01:16:20','2025-10-14 22:47:44',NULL),
(44,'8f5d7588-1598-4065-8213-f8817592f62f','2025-10-25','19:00:00','Любовный напиток','любовный напиток','Для взрослых','1624','https://www.zazerkal.spb.ru/tickets/1624.htm','https://www.zazerkal.spb.ru/repertoire/product162.htm','https://www.zazerkal.spb.ru/images/data/repertoire/162_small_1732876877.jpeg','==В ролях:==\n\'\'\'Неморино\'\'\' — Роман Арндт\n\'\'\'Адина\'\'\' — Татьяна Закирова\n\'\'\'Белькоре\'\'\' — Иван Васильев\n\'\'\'Дулькамара\'\'\' — Иван Красавцев\n\'\'\'Джаннетта\'\'\' — Анна Снегова\n\'\'\'Гаэтано\'\'\' — Сергей Алёшин\n\'\'\'Нотариус\'\'\' — Евгений Кузнецов\n\'\'\'жители деревни\'\'\' — Юрий Васильев, Екатерина Каурова, Сергей Румянцев, Юлия Андрушкевич, Андрей Удалов, Ольга Фурман, Анна Щербакова, Кирилл Костромин, Сергей Ваганов, Полина Поляцкая, Валентина Непряхина, Елена Журавлёва, Софья Шех, Елена Понятовская\n\n[[photo-35124177_331473554|450x300px| ]]\n\n\'\'\'Дирижёр\'\'\' — Павел Бубельников\n\n\'\'\'[http://www.zazerkал.spb.ru/tickets/1624.htm|КУПИТЬ БИЛЕТ]\'\'\'',0,23,'Любовный',10,2025,'2025-10-14 01:16:20','2025-10-14 23:38:26',NULL),
(45,'8f5d7588-1598-4065-8213-f8817592f62f','2025-10-26','12:00:00','Путешествие Муравьишки, или От рассвета до заката','путешествие муравьишки или от рассвета до заката','Для всей семьи','1620','https://www.zazerkal.spb.ru/tickets/1620.htm','https://www.zazerkal.spb.ru/repertoire/product241.htm','https://www.zazerkal.spb.ru/images/data/repertoire/241_small_1729949454.jpg','==В ролях:==\n\'\'\'Муравьишка\'\'\', он же \'\'\'Мур\'\'\' — Семён Фатыхов\n\'\'\'Вейка\'\'\', его подружка — Марина Техтелёва\n\'\'\'Чер\'\'\' — Кирилл Костромин\n\'\'\'Паучок-дирижёр\'\'\' — Анна Щербакова\n\'\'\'Бабочка\'\'\' — Анна Дарьянова\n\'\'\'Жук\'\'\' — Александр Подмешальский\n\'\'\'Водомерка\'\'\' — Юлия Андрушкевич\n\'\'\'Первый привратник\'\'\' — Сергей Ваганов\n\'\'\'Второй привратник\'\'\' — Сергей Алёшин\n\'\'\'Жители муравейника\'\'\' — Екатерина Огнева, Людмила Окель, Полина Поляцкая, Анна Григорьева, Дмитрий Фёдоров, Андрей Михеев\n\n[[photo-35124177_457239684|400x267px| ]]\n\n\'\'\'Дирижёр\'\'\' — Егор Прокопьев\n\n\n\'\'\'[http://www.zazerkal.spb.ru/tickets/1620.htm|КУПИТЬ БИЛЕТ]\'\'\'',0,25,'Муравей',10,2025,'2025-10-14 01:16:20','2025-11-08 02:15:30',NULL),
(46,'8f5d7588-1598-4065-8213-f8817592f62f','2025-10-26','15:00:00','Любимая игрушка','любимая игрушка','Для детей','1637','https://www.zazerkal.spb.ru/tickets/1637.htm','https://www.zazerkal.spb.ru/repertoire/product181.htm','https://www.zazerkal.spb.ru/images/data/repertoire/181_small_1727891052.jpg','==В ролях:==\n\'\'\'Девочка\'\'\' — Елизавета Майданова\n\'\'\'Зайчик\'\'\' — Настасья Янюшкина\n\'\'\'Лисёнок\'\'\' — Елена Журавлёва\n\n[[photo-35124177_457239602|450x300px| ]]\n\n\n\'\'\'[http://www.zazerkal.spb.ru/tickets/1637.htm|КУПИТЬ БИЛЕТ]\'\'\'',0,3,'Любимая',10,2025,'2025-10-14 01:16:20','2025-11-08 14:41:29',NULL),
(47,'8f5d7588-1598-4065-8213-f8817592f62f','2025-10-26','19:00:00','Мадам Баттерфляй','мадам баттерфляй','Для взрослых','1622','https://www.zazerkal.spb.ru/tickets/1622.htm','https://www.zazerkal.spb.ru/repertoire/product168.htm','https://www.zazerkal.spb.ru/images/data/repertoire/168_small_1729097666.jpg','==В ролях:==\n\'\'\'Чио-Чио-Сан (мадам Баттерфляй)\'\'\', гейша — Александра Бабаян\n\'\'\'Бенджамин Франклин Пинкертон\'\'\', офицер ВМФ США — Дмитрий Каляка\n\'\'\'Шарплес\'\'\', американский консул — Дмитрий Танеев\n\'\'\'Судзуки\'\'\', служанка Баттерфляй — Екатерина Курбанова\n\'\'\'Горо\'\'\', маклер — Юрий Васильев\n\'\'\'Бонза\'\'\', дядя Чио-Чио-Сан — Алексей Сазонов\n\'\'\'Принц Ямадори\'\'\' — Сергей Поваляев\n\'\'\'Кэт Пинкертон\'\'\' — Анна Смирнова\n\'\'\'Комиссар\'\'\' — Сергей Румянцев\n\n[[photo-35124177_374764207|450x300px| ]]\n\n\'\'\'Дирижёр\'\'\' — Павел Бубельников\n\n\n\'\'\'[http://www.zazerkal.spb.ru/tickets/1622.htm|КУПИТЬ БИЛЕТ]\'\'\'',0,26,'Баттерфляй',10,2025,'2025-10-14 01:16:20','2025-11-08 02:16:07',NULL),
(48,'8f5d7588-1598-4065-8213-f8817592f62f','2025-10-28','12:00:00','Теремок','теремок','Для детей','1641','https://www.zazerkal.spb.ru/tickets/1641.htm','https://www.zazerkal.spb.ru/repertoire/product208.htm','https://www.zazerkal.spb.ru/images/data/repertoire/208_small_1731491252.jpg','==В ролях:==\n\'\'\'Мышь\'\'\' — Марина Техтелёва\n\'\'\'Лягушка\'\'\' — Полина Ульянова\n\'\'\'Заяц\'\'\' — Артём Мисаженков\n\'\'\'Волк\'\'\' — Сергей Алёшин\n\'\'\'Лиса\'\'\' — Елена Понятовская\n\'\'\'Медведь\'\'\' — Александр Подмешальский\n\'\'\'Птички\'\'\' — Анастасия Солари, Анна Щербакова\n\n[[photo1047721_456240798|450x337px| ]]\n\n\n\'\'\'[http://www.zazerkал.spb.ru/tickets/1641.htm|КУПИТЬ БИЛЕТ]\'\'\'',0,5,'Теремок',10,2025,'2025-10-14 01:16:20','2025-10-21 10:43:48',NULL),
(49,'8f5d7588-1598-4065-8213-f8817592f62f','2025-10-28','15:00:00','Приключения Незнайки','приключения незнайки','Для всей семьи','1628','https://www.zazerkal.spb.ru/tickets/1628.htm','https://www.zazerkal.spb.ru/repertoire/product159.htm','https://www.zazerkal.spb.ru/images/data/repertoire/159_small_1729624731.jpg','==В ролях:==\n\'\'\'Незнайка\'\'\' — Антон Хомяков\n\'\'\'Знайка\'\'\' — Сергей Патракеев\n\'\'\'Цветик\'\'\' — Николай Погорелов\n\'\'\'Гусля\'\'\' — Кирилл Жуков\n\'\'\'Тюбик\'\'\' — Сергей Поваляев\n\'\'\'Шпунтик\'\'\' — Евгений Кузнецов\n\'\'\'Грабля\'\'\' — Иван Красавцев\n\'\'\'Кнопочка\'\'\' — Елизавета Алексеева\n\'\'\'Пуговка\'\'\' — Ольга Красных\n\'\'\'Гунька\'\'\' — Сергей Ермолаев\n\'\'\'Пегасик\'\'\' — Дмитрий Фёдоров\n\'\'\'Совесть\'\'\' — Анна Кочетова\n\'\'\'Синеглазка\'\'\' — Анастасия Солари\n\'\'\'Медуница\'\'\' — Екатерина Ефимова\n\'\'\'Белочка\'\'\' — Мария Мукупа\n\'\'\'Маргаритка\'\'\' — Людмила Окель\n\'\'\'Кубышка\'\'\' — Валентина Непряхина\n\'\'\'Волшебник\'\'\' — Сергей Румянцев\n\n[[photo-35124177_358607288|450x321px| ]]\n\n\n\'\'\'[http://www.zazerkal.spb.ru/tickets/1628.htm|КУПИТЬ БИЛЕТ]\'\'\'',0,27,'Незнайка',10,2025,'2025-10-14 01:16:20','2025-11-08 14:42:30',NULL),
(50,'8f5d7588-1598-4065-8213-f8817592f62f','2025-10-29','12:00:00','Чехов. В рождественскую ночь','чехов в рождественскую ночь','Для всей семьи','1625','https://www.zazerkal.spb.ru/tickets/1625.htm','https://www.zazerkal.spb.ru/repertoire/product359.htm','https://www.zazerkal.spb.ru/images/data/repertoire/359_small_1728130838.jpg','==В ролях:==\n\'\'\'Чечевицын\'\'\' — Артём Мисаженков\n\'\'\'Мать Чечевицына\'\'\' — Юлия Андрушкевич\n\'\'\'Володя\'\'\' — Антон Хомяков\n\'\'\'Отец Володи\'\'\' — Семён Фатыхов\n\'\'\'Мать Володи\'\'\' — Софья Шех\n\'\'\'Маша\'\'\' — Елизавета Алексеева\n\'\'\'Ольга\'\'\' — Анастасия Янюшкина\n\'\'\'Ирка\'\'\' — Елизавета Майданова\n\'\'\'Кухарка\'\'\' — Ярослава Раильтянина\n\'\'\'Жандарм\'\'\' — Иван Красавцев\n\'\'\'Продавец пороха\'\'\' — Дмитрий Фёдоров\n\'\'\'Люди на вокзале\'\'\' — Полина Ульянова, Екатерина Каурова, Анна Григорьева, Анна Кочетова, Екатерина Огнева\n\'\'\'Ванька\'\'\' — Елизавета Майданова\n\'\'\'Дед Константин Макарыч\'\'\' — Кирилл Костромин\n\'\'\'Сапожник\'\'\' — Иван Красавцев\n\'\'\'Жена сапожника\'\'\' — Екатерина Каурова\n\'\'\'Подмастерья\'\'\' — Дмитрий Фёдоров, Максим Левин, Семён Фатыхов\n\'\'\'Ямщик\'\'\' — Сергей Ваганов\n\'\'\'Деревенские девушки\'\'\' — Анастасия Янюшкина, Анна Григорьева, Софья Шех, Полина Ульянова, Ярослава Раильтянина, Елизавета Алексеева, Анна Кочетова, Екатерина Огнева, Юлия Андрушкевич\n\n[[photo-35124177_457239802|400x267px| ]]\n\n\'\'\'Дирижёр\'\'\' — Егор Прокопьев\n\n\'\'\'[http://www.zazerkал.spb.ru/tickets/1625.htm|КУПИТЬ БИЛЕТ]\'\'\'',0,28,'Чехов',10,2025,'2025-10-14 01:16:20','2025-10-21 10:52:15',NULL),
(51,'8f5d7588-1598-4065-8213-f8817592f62f','2025-10-29','15:00:00','Крокодил','крокодил','Для всей семьи','1642','https://www.zazerkal.spb.ru/tickets/1642.htm','https://www.zazerkal.spb.ru/repertoire/product230.htm','https://www.zazerkal.spb.ru/images/data/repertoire/230_small_1733324912.jpg','==В ролях:==\n\'\'\'Крокодил, Кокоша, Лелёша, Тигрица, Гамлет — принц датский, а также очень много зверей\'\'\' — Андрей Михеев\n\'\'\'Ваня В., Крокодилица, Тотоша, Лялечка, Офелия (о нимфа!) и другие\'\'\' — Кирилл Павлов\n\'\'\'Злобный Помощник Режиссёра\'\'\' — Вероника Ищенко\n\n[[photo-35124177_295677900|450x300px| ]]\n\n\n\'\'\'[http://www.zazerkал.spb.ru/tickets/1642.htm|КУПИТЬ БИЛЕТ]\'\'\'',0,16,'Крокодил',10,2025,'2025-10-14 01:16:20','2025-10-21 10:54:00',NULL),
(52,'8f5d7588-1598-4065-8213-f8817592f62f','2025-10-30','12:00:00','Белый клык','белый клык','Для всей семьи','1623','https://www.zazerkal.spb.ru/tickets/1623.htm','https://www.zazerkal.spb.ru/repertoire/product150.htm','https://www.zazerkal.spb.ru/images/data/repertoire/150_small_1732377227.jpg','==В ролях:==\n\'\'\'Белый Клык\'\'\' — Кирилл Павлов\n\'\'\'Волчонок\'\'\' — Ольга Красных\n\'\'\'Волчица Кичи\'\'\' — Анна Снегова\n\'\'\'Серый Бобр\'\'\', индеец — Андрей Михеев\n\'\'\'Мит-Су\'\'\', его сын — Екатерина Ефимова\n\'\'\'Клу-Куч\'\'\', шаманка — Сауле Искакова\n\'\'\'Лип-Лип\'\'\', собачий вожак — Антон Хомяков\n\'\'\'Красавчик Смит\'\'\' — Денис Колесников\n\'\'\'Скотт\'\'\' — Сергей Ермолаев\n\'\'\'Мэтт\'\'\' — Сергей Патракеев\n\'\'\'Бульдог\'\'\' — Артём Мисаженков\n\'\'\'Отец Скотта\'\'\' — Александр Подмешальский\n\'\'\'Сын Скотта\'\'\' — Юрий Васильев\n\'\'\'Дочь Скотта\'\'\' — Любовь Голубева\n\'\'\'Жена Скотта\'\'\' — Екатерина Каурова\n\'\'\'Овчарка\'\'\' — Мария Мукупа\n\'\'\'Волки\'\'\', собаки, индейцы, золотоискатели — Юрий Васильев, Дмитрий Фёдоров, Артём Мисаженков, Евгений Кузнецов\n\'\'\'Щенки\'\'\' — Любовь Голубева, Екатерина Агафонова, Елизавета Майданова, Анастасия Солари\n\'\'\'Женщины племени\'\'\', девушки на пристани Доусона, калифорнийские красотки — Екатерина Каурова, Елена Журавлёва, Полина Поляцкая, Анастасия Янюшкина\n\n[[photo1047721_456243028|450x300px| ]]\n\n\'\'\'Дирижёр\'\'\' — Егор Прокопьев\n\n\'\'\'[http://www.zazerkал.spb.ru/tickets/1623.htm|КУПИТЬ БИЛЕТ]\'\'\'',0,7,'Клык',10,2025,'2025-10-14 01:16:20','2025-10-21 10:59:02',NULL),
(53,'8f5d7588-1598-4065-8213-f8817592f62f','2025-10-30','16:00:00','Белый клык','белый клык','Для всей семьи','1630','https://www.zazerkal.spb.ru/tickets/1630.htm','https://www.zazerkal.spb.ru/repertoire/product150.htm','https://www.zazerkal.spb.ru/images/data/repertoire/150_small_1732377227.jpg','==В ролях:==\n\'\'\'Белый Клык\'\'\' — Никита Хвостов\n\'\'\'Волчонок\'\'\' — Ольга Красных\n\'\'\'Волчица Кичи\'\'\' — Анна Снегова\n\'\'\'Серый Бобр\'\'\', индеец — Андрей Михеев\n\'\'\'Мит-Су\'\'\', его сын — Екатерина Ефимова\n\'\'\'Клу-Куч\'\'\', шаманка — Елена Терновая\n\'\'\'Лип-Лип\'\'\', собачий вожак — Антон Хомяков\n\'\'\'Красавчик Смит\'\'\' — Денис Колесников\n\'\'\'Скотт\'\'\' — Сергей Ермолаев\n\'\'\'Мэтт\'\'\' — Сергей Патракеев\n\'\'\'Бульдог\'\'\' — Артём Мисаженков\n\'\'\'Отец Скотта\'\'\' — Александр Подмешальский\n\'\'\'Сын Скотта\'\'\' — Юрий Васильев\n\'\'\'Дочь Скотта\'\'\' — Любовь Голубева\n\'\'\'Жена Скотта\'\'\' — Екатерина Каурова\n\'\'\'Овчарка\'\'\' — Мария Мукупа\n\'\'\'Волки\'\'\', собаки, индейцы, золотоискатели — Юрий Васильев, Дмитрий Фёдоров, Евгений Кузнецов, Артём Мисаженков\n\'\'\'Щенки\'\'\' — Елизавета Майданова, Екатерина Агафонова, Анастасия Солари, Любовь Голубева\n\'\'\'Женщины племени\'\'\', девушки на пристани Доусона, калифорнийские красотки — Анастасия Янюшкина, Елена Журавлёва, Екатерина Каурова, Полина Поляцкая\n\n[[photo1047721_456243028|450x300px| ]]\n\n\'\'\'Дирижёр\'\'\' — Егор Прокопьев\n\n\'\'\'[http://www.zazerkал.spb.ru/tickets/1630.htm|КУПИТЬ БИЛЕТ]\'\'\'',0,7,'Клык',10,2025,'2025-10-14 01:16:20','2025-10-21 11:02:24',NULL),
(54,'8f5d7588-1598-4065-8213-f8817592f62f','2025-10-31','12:00:00','Что случилось в пятом \"Б\"','что случилось в пятом б','Для всей семьи','1639','https://www.zazerkal.spb.ru/tickets/1639.htm','https://www.zazerkal.spb.ru/repertoire/product302.htm','https://www.zazerkal.spb.ru/images/data/repertoire/302_small_1680697031.jpg','==В ролях:==\n\'\'\'Касьян Серафимович\'\'\', учитель биологии — Иван Красавцев\n\'\'\'Семён Семёнович\'\'\', учитель пения — Евгений Кузнецов\n\'\'\'Алла Романовна\'\'\', учительница английского — Ярослава Раильтянина\n\'\'\'Смирнов\'\'\' — Антон Хомяков\n\'\'\'Спицина\'\'\' — Елизавета Алексеева\n\'\'\'Торопыгина\'\'\' — Елизавета Майданова\n\'\'\'Петя Душнов\'\'\' — Дмитрий Фёдоров (\'\'впервые в роли\'\')\n\n====Обитатели живого уголка:====\n\'\'\'Питон\'\'\' — Дмитрий Фёдоров (\'\'впервые в роли\'\')\n\'\'\'Попугаи\'\'\' — Семён Фатыхов, Настасья Янюшкина\n\'\'\'Тритон\'\'\' — Софья Шех\n\'\'\'Курица Клуха\'\'\' — Дарья Косенко-Вишневецкая\n\n\'\'\'Валентина Прокопьевна\'\'\', учительница русского — Настасья Янюшкина\n\'\'\'Толя Мехнов\'\'\' — Артём Мисаженков\n\'\'\'Мама Толи\'\'\' — Софья Шех\n\'\'\'Пончик\'\'\' — Никита Хвостов\n\'\'\'Зинка\'\'\', его сестра — Елизавета Майданова\n\'\'\'Тётя Феня\'\'\', повариха — Ярослава Раильтянина\n\'\'\'Доктор\'\'\' — Иван Красавцев\n\'\'\'Пожарный\'\'\' — Евгений Кузнецов\n\n\'\'\'Ученики пятого «Б»\'\'\' — артисты театра\n\n[[photo-35124177_457239721|400x267px| ]]\n\n\n\'\'\'[http://www.zazerkal.spb.ru/tickets/1639.htm|КУПИТЬ БИЛЕТ]\'\'\'',0,29,'5б',10,2025,'2025-10-14 01:16:20','2025-11-08 15:12:10',NULL),
(55,'8f5d7588-1598-4065-8213-f8817592f62f','2025-10-31','15:00:00','Что случилось в пятом \"Б\"','что случилось в пятом б','Для всей семьи','1638','https://www.zazerkal.spb.ru/tickets/1638.htm','https://www.zazerkal.spb.ru/repertoire/product302.htm','https://www.zazerkal.spb.ru/images/data/repertoire/302_small_1680697031.jpg','==В ролях:==\n\'\'\'Касьян Серафимович\'\'\', учитель биологии — Иван Красавцев\n\'\'\'Семён Семёнович\'\'\', учитель пения — Евгений Кузнецов\n\'\'\'Алла Романовна\'\'\', учительница английского — Ярослава Раильтянина\n\'\'\'Смирнов\'\'\' — Антон Хомяков\n\'\'\'Спицина\'\'\' — Елизавета Алексеева\n\'\'\'Торопыгина\'\'\' — Елизавета Майданова\n\'\'\'Петя Душнов\'\'\' — Дмитрий Фёдоров\n\n====Обитатели живого уголка:====\n\'\'\'Питон\'\'\' — Дмитрий Фёдоров\n\'\'\'Попугаи\'\'\' — Семён Фатыхов, Настасья Янюшкина\n\'\'\'Тритон\'\'\' — Софья Шех\n\'\'\'Курица Клуха\'\'\' — Дарья Косенко-Вишневецкая\n\n\'\'\'Валентина Прокопьевна\'\'\', учительница русского — Настасья Янюшкина\n\'\'\'Толя Мехнов\'\'\' — Артём Мисаженков\n\'\'\'Мама Толи\'\'\' — Софья Шех\n\'\'\'Пончик\'\'\' — Никита Хвостов\n\'\'\'Зинка\'\'\', его сестра — Елизавета Майданова\n\'\'\'Тётя Феня\'\'\', повариха — Ярослава Раильтянина\n\'\'\'Доктор\'\'\' — Иван Красавцев\n\'\'\'Пожарный\'\'\' — Евгений Кузнецов\n\n\'\'\'Ученики пятого «Б»\'\'\' — артисты театра\n\n[[photo-35124177_457239721|400x267px| ]]\n\n\n\'\'\'[http://www.zazerkal.spb.ru/tickets/1638.htm|КУПИТЬ БИЛЕТ]\'\'\'',0,29,'5б',10,2025,'2025-10-14 01:16:20','2025-11-08 15:13:01',NULL),
(56,'8f5d7588-1598-4065-8213-f8817592f62f','2025-10-31','19:00:00','Сказка о царе Салтане','сказка о царе салтане','Для всей семьи','1629','https://www.zazerkal.spb.ru/tickets/1629.htm','https://www.zazerkal.spb.ru/repertoire/product357.htm','https://www.zazerkal.spb.ru/images/data/repertoire/357_small_1728131670.jpg','==В ролях:==\n\'\'\'Царь Салтан\'\'\' — Алексей Сазонов\n\'\'\'Царица Милитриса\'\'\' — Анна Снегова\n\'\'\'Ткачиха\'\'\' — Полина Поляцкая\n\'\'\'Повариха\'\'\' — Людмила Окель\n\'\'\'Бабариха\'\'\' — Анна Дарьянова\n\'\'\'Князь Гвидон\'\'\' — Симеон Асеев\n\'\'\'Царевна Лебедь\'\'\' — Виктория Романова\n\'\'\'Старый дед, Корабельщик\'\'\' — Иван Васильев\n\'\'\'Гонец, Корабельщик\'\'\' — Сергей Поваляев\n\'\'\'Скоморох, Корабельщик\'\'\' — Иван Красавцев\n\'\'\'Шуты гороховые\'\'\' — Настасья Янюшкина, Елена Журавлёва, Сергей Ваганов, Кирилл Корсаков\n\'\'\'Скоморохи\'\'\' — Сергей Патракеев, Денис Колесников\n\'\'\'Стражники, народ, нянюшки, матроны\'\'\' — артисты театра\n\n[[photo-110316070_457245830|400x267px| ]]\n\n\'\'\'Дирижёр\'\'\' — Пётр Максимов\n\n\n\'\'\'[http://www.zazerkal.spb.ru/tickets/1629.htm|КУПИТЬ БИЛЕТ]\'\'\'',0,9,'Салтан',10,2025,'2025-10-14 01:16:20','2025-11-08 15:14:16',NULL),
(72,'2836c152-ebd2-44f2-8314-11f01575a577','2025-12-04','19:00:00','Отелло','отелло','Для взрослых','1682','https://www.zazerkal.spb.ru/tickets/1682.htm','https://www.zazerkal.spb.ru/repertoire/product196.htm','https://www.zazerkal.spb.ru/images/data/repertoire/196_small_1747944424.jpeg','==В ролях:==\n\'\'СОСТАВ УТОЧНЯЕТСЯ\'\'\n\n\'\'\'[http://www.zazerkal.spb.ru/tickets/1682.htm|КУПИТЬ БИЛЕТ]\'\'\'',0,53,'Отелло',12,2025,'2025-11-08 17:25:21','2025-11-08 17:26:03','Отелло_04.12.25'),
(73,'2836c152-ebd2-44f2-8314-11f01575a577','2025-12-06','12:00:00','Три поросенка','три поросенка','Для детей','1689','https://www.zazerkal.spb.ru/tickets/1689.htm','https://www.zazerkal.spb.ru/repertoire/product164.htm','https://www.zazerkal.spb.ru/images/data/repertoire/164_small_1727892096.jpg','==В ролях:==\n\'\'СОСТАВ УТОЧНЯЕТСЯ\'\'\n\n\'\'\'[http://www.zazerkal.spb.ru/tickets/1689.htm|КУПИТЬ БИЛЕТ]\'\'\'',0,8,'Свиньи',12,2025,'2025-11-08 17:25:21','2025-11-08 17:26:03','Три_поросёнка_06.12.25'),
(74,'2836c152-ebd2-44f2-8314-11f01575a577','2025-12-07','12:00:00','Сказание о Рикки-Тикки-Тави в девятнадцати песнях','сказание о рикки тикки тави в девятнадцати песнях','Для всей семьи','1683','https://www.zazerkal.spb.ru/tickets/1683.htm','https://www.zazerkal.spb.ru/repertoire/product163.htm','https://www.zazerkal.spb.ru/images/data/repertoire/163_small_1729078320.jpg','==В ролях:==\n\'\'СОСТАВ УТОЧНЯЕТСЯ\'\'\n\n\'\'\'[http://www.zazerkal.spb.ru/tickets/1683.htm|КУПИТЬ БИЛЕТ]\'\'\'',0,21,'Рикки',12,2025,'2025-11-08 17:25:21','2025-11-08 17:26:03','Сказание_о_Рикки-Тикки-Тави_07.12.25'),
(75,'2836c152-ebd2-44f2-8314-11f01575a577','2025-12-07','15:00:00','Крокодил','крокодил','Для всей семьи','1688','https://www.zazerkal.spb.ru/tickets/1688.htm','https://www.zazerkal.spb.ru/repertoire/product230.htm','https://www.zazerkal.spb.ru/images/data/repertoire/230_small_1733324912.jpg','==В ролях:==\n\'\'СОСТАВ УТОЧНЯЕТСЯ\'\'\n\n\'\'\'[http://www.zazerkal.spb.ru/tickets/1688.htm|КУПИТЬ БИЛЕТ]\'\'\'',0,16,'Крокодил',12,2025,'2025-11-08 17:25:21','2025-11-08 17:26:03','Крокодил_07.12.25'),
(76,'2836c152-ebd2-44f2-8314-11f01575a577','2025-12-07','19:00:00','Вечер еврейской музыки','вечер еврейской музыки','Для всей семьи','1686','https://www.zazerkal.spb.ru/tickets/1686.htm','https://www.zazerkal.spb.ru/repertoire/product267.htm','https://www.zazerkal.spb.ru/images/data/repertoire/267_small_1746129236.jpg','==В ролях:==\n\'\'СОСТАВ УТОЧНЯЕТСЯ\'\'\n\n\'\'\'[http://www.zazerkal.spb.ru/tickets/1686.htm|КУПИТЬ БИЛЕТ]\'\'\'',0,34,'Скрипач',12,2025,'2025-11-08 17:25:21','2025-11-08 17:26:03','Вечер_еврейской_музыки_07.12.25'),
(77,'2836c152-ebd2-44f2-8314-11f01575a577','2025-12-13','12:00:00','Мишкина каша','мишкина каша','Для всей семьи','1695','https://www.zazerkal.spb.ru/tickets/1695.htm','https://www.zazerkal.spb.ru/repertoire/product481.htm','https://www.zazerkal.spb.ru/images/data/repertoire/481_small_1746126550.jpg','==В ролях:==\n\'\'СОСТАВ УТОЧНЯЕТСЯ\'\'\n\n\'\'\'[http://www.zazerkal.spb.ru/tickets/1695.htm|КУПИТЬ БИЛЕТ]\'\'\'',0,19,'Каша',12,2025,'2025-11-08 17:25:21','2025-11-08 17:26:03','Мишкина_каша_13.12.25_12'),
(78,'2836c152-ebd2-44f2-8314-11f01575a577','2025-12-13','15:00:00','Мишкина каша','мишкина каша','Для всей семьи','1693','https://www.zazerkal.spb.ru/tickets/1693.htm','https://www.zazerkal.spb.ru/repertoire/product481.htm','https://www.zazerkal.spb.ru/images/data/repertoire/481_small_1746126550.jpg','==В ролях:==\n\'\'СОСТАВ УТОЧНЯЕТСЯ\'\'\n\n\'\'\'[http://www.zazerkal.spb.ru/tickets/1693.htm|КУПИТЬ БИЛЕТ]\'\'\'',0,19,'Каша',12,2025,'2025-11-08 17:25:21','2025-11-08 17:26:03','Мишкина_каша_13.12.25_15'),
(79,'2836c152-ebd2-44f2-8314-11f01575a577','2025-12-13','19:00:00','Гиперболоид инженера Гарина','гиперболоид инженера гарина','Для взрослых','1684','https://www.zazerkal.spb.ru/tickets/1684.htm','https://www.zazerkal.spb.ru/repertoire/product271.htm','https://www.zazerkal.spb.ru/images/data/repertoire/271_small_1762002893.jpeg','==В ролях:==\n\'\'СОСТАВ УТОЧНЯЕТСЯ\'\'\n\n\'\'\'[http://www.zazerkal.spb.ru/tickets/1684.htm|КУПИТЬ БИЛЕТ]\'\'\'',0,51,'Гиперболоид',12,2025,'2025-11-08 17:25:21','2025-11-08 17:26:03','Гиперболоид_инженера_Гарина_13.12.25'),
(80,'2836c152-ebd2-44f2-8314-11f01575a577','2025-12-14','12:00:00','Теремок','теремок','Для детей','1691','https://www.zazerkal.spb.ru/tickets/1691.htm','https://www.zazerkal.spb.ru/repertoire/product208.htm','https://www.zazerkal.spb.ru/images/data/repertoire/208_small_1731491252.jpg','==В ролях:==\n\'\'СОСТАВ УТОЧНЯЕТСЯ\'\'\n\n\'\'\'[http://www.zazerkal.spb.ru/tickets/1691.htm|КУПИТЬ БИЛЕТ]\'\'\'',0,5,'Теремок',12,2025,'2025-11-08 17:25:21','2025-11-08 17:26:03','Теремок_14.12.25_12'),
(81,'2836c152-ebd2-44f2-8314-11f01575a577','2025-12-14','15:00:00','Теремок','теремок','Для детей','1694','https://www.zazerkal.spb.ru/tickets/1694.htm','https://www.zazerkal.spb.ru/repertoire/product208.htm','https://www.zazerkal.spb.ru/images/data/repertoire/208_small_1731491252.jpg','==В ролях:==\n\'\'СОСТАВ УТОЧНЯЕТСЯ\'\'\n\n\'\'\'[http://www.zazerkal.spb.ru/tickets/1694.htm|КУПИТЬ БИЛЕТ]\'\'\'',0,5,'Теремок',12,2025,'2025-11-08 17:25:21','2025-11-08 17:26:03','Теремок_14.12.25_15'),
(82,'2836c152-ebd2-44f2-8314-11f01575a577','2025-12-14','19:00:00','Гиперболоид инженера Гарина','гиперболоид инженера гарина','Для взрослых','1687','https://www.zazerkal.spb.ru/tickets/1687.htm','https://www.zazerkal.spb.ru/repertoire/product271.htm','https://www.zazerkal.spb.ru/images/data/repertoire/271_small_1762002893.jpeg','==В ролях:==\n\'\'СОСТАВ УТОЧНЯЕТСЯ\'\'\n\n\'\'\'[http://www.zazerkal.spb.ru/tickets/1687.htm|КУПИТЬ БИЛЕТ]\'\'\'',0,51,'Гиперболоид',12,2025,'2025-11-08 17:25:21','2025-11-08 17:26:03','Гиперболоид_инженера_Гарина_14.12.25'),
(83,'2836c152-ebd2-44f2-8314-11f01575a577','2025-12-19','19:00:00','Порги и Бесс','порги и бесс','Для взрослых','1685','https://www.zazerkal.spb.ru/tickets/1685.htm','https://www.zazerkal.spb.ru/repertoire/product172.htm','https://www.zazerkal.spb.ru/images/data/repertoire/172_small_1742506127.png','==В ролях:==\n\'\'СОСТАВ УТОЧНЯЕТСЯ\'\'\n\n\'\'\'[http://www.zazerkal.spb.ru/tickets/1685.htm|КУПИТЬ БИЛЕТ]\'\'\'',0,6,'Порги',12,2025,'2025-11-08 17:25:21','2025-11-08 17:26:03','Порги_и_Бесс_19.12.25'),
(84,'2836c152-ebd2-44f2-8314-11f01575a577','2025-12-20','19:00:00','Игра в классики','игра в классики','Для взрослых','1692','https://www.zazerkal.spb.ru/tickets/1692.htm','https://www.zazerkal.spb.ru/repertoire/product518.htm','https://www.zazerkal.spb.ru/images/data/repertoire/518_small_1757077370.jpeg','==В ролях:==\n\'\'СОСТАВ УТОЧНЯЕТСЯ\'\'\n\n\'\'\'[http://www.zazerkal.spb.ru/tickets/1692.htm|КУПИТЬ БИЛЕТ]\'\'\'',0,11,'Вайль',12,2025,'2025-11-08 17:25:21','2025-11-08 17:26:03','Курт_Вайль._Игра_в_классики_20.12.25'),
(85,'2836c152-ebd2-44f2-8314-11f01575a577','2025-12-21','15:00:00','Три апельсина. Встреча третья','три апельсина встреча третья','Для всей семьи','1680','https://www.zazerkal.spb.ru/tickets/1680.htm','https://www.zazerkal.spb.ru/repertoire/product362.htm','https://www.zazerkal.spb.ru/images/img/plug.jpg','==В ролях:==\n\'\'СОСТАВ УТОЧНЯЕТСЯ\'\'\n\n\'\'\'[http://www.zazerkal.spb.ru/tickets/1680.htm|КУПИТЬ БИЛЕТ]\'\'\'',0,10,'Апельсины',12,2025,'2025-11-08 17:25:21','2025-11-08 17:25:21',NULL),
(86,'2836c152-ebd2-44f2-8314-11f01575a577','2025-12-21','19:00:00','Империя оперы','империя оперы','Для всей семьи','1731','https://www.zazerkal.spb.ru/tickets/1731.htm','https://www.zazerkal.spb.ru/repertoire/product536.htm','https://www.zazerkal.spb.ru/images/data/repertoire/536_small_1762602336.jpeg','==В ролях:==\n\'\'СОСТАВ УТОЧНЯЕТСЯ\'\'\n\n\'\'\'[http://www.zazerkal.spb.ru/tickets/1731.htm|КУПИТЬ БИЛЕТ]\'\'\'',0,66,'Империя',12,2025,'2025-11-08 17:25:21','2025-11-08 17:26:03','Империя_оперы_21.12.25'),
(87,'2836c152-ebd2-44f2-8314-11f01575a577','2025-12-23','13:30:00','Маша у гномов на ёлке','маша у гномов на елке','Для всей семьи','1724','https://www.zazerkal.spb.ru/tickets/1724.htm','https://www.zazerkal.spb.ru/repertoire/product521.htm','https://www.zazerkal.spb.ru/images/data/repertoire/521_small_1762600286.jpeg','==В ролях:==\n\'\'СОСТАВ УТОЧНЯЕТСЯ\'\'\n\n\'\'\'[http://www.zazerkal.spb.ru/tickets/1724.htm|КУПИТЬ БИЛЕТ]\'\'\'',0,64,'Гномы',12,2025,'2025-11-08 17:25:21','2025-11-08 17:26:03','Маша_у_гномов_на_ёлке_23.12.25'),
(88,'2836c152-ebd2-44f2-8314-11f01575a577','2025-12-24','11:00:00','Маша у гномов на ёлке','маша у гномов на елке','Для всей семьи','1723','https://www.zazerkal.spb.ru/tickets/1723.htm','https://www.zazerkal.spb.ru/repertoire/product521.htm','https://www.zazerkal.spb.ru/images/data/repertoire/521_small_1762600286.jpeg','==В ролях:==\n\'\'СОСТАВ УТОЧНЯЕТСЯ\'\'\n\n\'\'\'[http://www.zazerkal.spb.ru/tickets/1723.htm|КУПИТЬ БИЛЕТ]\'\'\'',0,64,'Гномы',12,2025,'2025-11-08 17:25:21','2025-11-08 17:26:03','Маша_у_гномов_на_ёлке_24.12.25_11'),
(89,'2836c152-ebd2-44f2-8314-11f01575a577','2025-12-24','13:30:00','Маша у гномов на ёлке','маша у гномов на елке','Для всей семьи','1716','https://www.zazerkal.spb.ru/tickets/1716.htm','https://www.zazerkal.spb.ru/repertoire/product521.htm','https://www.zazerkal.spb.ru/images/data/repertoire/521_small_1762600286.jpeg','==В ролях:==\n\'\'СОСТАВ УТОЧНЯЕТСЯ\'\'\n\n\'\'\'[http://www.zazerkal.spb.ru/tickets/1716.htm|КУПИТЬ БИЛЕТ]\'\'\'',0,64,'Гномы',12,2025,'2025-11-08 17:25:21','2025-11-08 17:26:03','Маша_у_гномов_на_ёлке_24.12.25_1330'),
(90,'2836c152-ebd2-44f2-8314-11f01575a577','2025-12-25','11:00:00','Маша у гномов на ёлке','маша у гномов на елке','Для всей семьи','1726','https://www.zazerkal.spb.ru/tickets/1726.htm','https://www.zazerkal.spb.ru/repertoire/product521.htm','https://www.zazerkal.spb.ru/images/data/repertoire/521_small_1762600286.jpeg','==В ролях:==\n\'\'СОСТАВ УТОЧНЯЕТСЯ\'\'\n\n\'\'\'[http://www.zazerkal.spb.ru/tickets/1726.htm|КУПИТЬ БИЛЕТ]\'\'\'',0,64,'Гномы',12,2025,'2025-11-08 17:25:21','2025-11-08 17:26:03','Маша_у_гномов_на_ёлке_25.12.25_11'),
(91,'2836c152-ebd2-44f2-8314-11f01575a577','2025-12-25','13:30:00','Маша у гномов на ёлке','маша у гномов на елке','Для всей семьи','1718','https://www.zazerkal.spb.ru/tickets/1718.htm','https://www.zazerkal.spb.ru/repertoire/product521.htm','https://www.zazerkal.spb.ru/images/data/repertoire/521_small_1762600286.jpeg','==В ролях:==\n\'\'СОСТАВ УТОЧНЯЕТСЯ\'\'\n\n\'\'\'[http://www.zazerkal.spb.ru/tickets/1718.htm|КУПИТЬ БИЛЕТ]\'\'\'',0,64,'Гномы',12,2025,'2025-11-08 17:25:21','2025-11-08 17:26:03','Маша_у_гномов_на_ёлке_25.12.25_1330'),
(92,'2836c152-ebd2-44f2-8314-11f01575a577','2025-12-26','13:30:00','Маша у гномов на ёлке','маша у гномов на елке','Для всей семьи','1714','https://www.zazerkal.spb.ru/tickets/1714.htm','https://www.zazerkal.spb.ru/repertoire/product521.htm','https://www.zazerkal.spb.ru/images/data/repertoire/521_small_1762600286.jpeg','==В ролях:==\n\'\'СОСТАВ УТОЧНЯЕТСЯ\'\'\n\n\'\'\'[http://www.zazerkal.spb.ru/tickets/1714.htm|КУПИТЬ БИЛЕТ]\'\'\'',0,64,'Гномы',12,2025,'2025-11-08 17:25:21','2025-11-08 17:26:03','Маша_у_гномов_на_ёлке_26.12.25_1330'),
(93,'2836c152-ebd2-44f2-8314-11f01575a577','2025-12-26','16:00:00','Маша у гномов на ёлке','маша у гномов на елке','Для всей семьи','1727','https://www.zazerkal.spb.ru/tickets/1727.htm','https://www.zazerkal.spb.ru/repertoire/product521.htm','https://www.zazerkal.spb.ru/images/data/repertoire/521_small_1762600286.jpeg','==В ролях:==\n\'\'СОСТАВ УТОЧНЯЕТСЯ\'\'\n\n\'\'\'[http://www.zazerkal.spb.ru/tickets/1727.htm|КУПИТЬ БИЛЕТ]\'\'\'',0,64,'Гномы',12,2025,'2025-11-08 17:25:21','2025-11-08 17:26:03','Маша_у_гномов_на_ёлке_26.12.25_16'),
(94,'2836c152-ebd2-44f2-8314-11f01575a577','2025-12-27','11:00:00','Новый год на планете № 3','новый год на планете 3','Для всей семьи','1708','https://www.zazerkal.spb.ru/tickets/1708.htm','https://www.zazerkal.spb.ru/repertoire/product520.htm','https://www.zazerkal.spb.ru/images/data/repertoire/520_small_1762600258.jpeg','==В ролях:==\n\'\'СОСТАВ УТОЧНЯЕТСЯ\'\'\n\n\'\'\'[http://www.zazerkal.spb.ru/tickets/1708.htm|КУПИТЬ БИЛЕТ]\'\'\'',0,65,'Планета3',12,2025,'2025-11-08 17:25:21','2025-11-08 17:26:03','Новый_год_на_планете_№_3_27.12.25_11'),
(95,'2836c152-ebd2-44f2-8314-11f01575a577','2025-12-27','13:30:00','Маша у гномов на ёлке','маша у гномов на елке','Для всей семьи','1717','https://www.zazerkal.spb.ru/tickets/1717.htm','https://www.zazerkal.spb.ru/repertoire/product521.htm','https://www.zazerkal.spb.ru/images/data/repertoire/521_small_1762600286.jpeg','==В ролях:==\n\'\'СОСТАВ УТОЧНЯЕТСЯ\'\'\n\n\'\'\'[http://www.zazerkal.spb.ru/tickets/1717.htm|КУПИТЬ БИЛЕТ]\'\'\'',0,64,'Гномы',12,2025,'2025-11-08 17:25:21','2025-11-08 17:26:03','Маша_у_гномов_на_ёлке_27.12.25'),
(96,'2836c152-ebd2-44f2-8314-11f01575a577','2025-12-27','16:00:00','Новый год на планете № 3','новый год на планете 3','Для всей семьи','1709','https://www.zazerkal.spb.ru/tickets/1709.htm','https://www.zazerkal.spb.ru/repertoire/product520.htm','https://www.zazerkal.spb.ru/images/data/repertoire/520_small_1762600258.jpeg','==В ролях:==\n\'\'СОСТАВ УТОЧНЯЕТСЯ\'\'\n\n\'\'\'[http://www.zazerkal.spb.ru/tickets/1709.htm|КУПИТЬ БИЛЕТ]\'\'\'',0,65,'Планета3',12,2025,'2025-11-08 17:25:21','2025-11-08 17:26:03','Новый_год_на_планете_№_3_27.12.25_16'),
(97,'2836c152-ebd2-44f2-8314-11f01575a577','2025-12-28','11:00:00','Новый год на планете № 3','новый год на планете 3','Для всей семьи','1701','https://www.zazerkal.spb.ru/tickets/1701.htm','https://www.zazerkal.spb.ru/repertoire/product520.htm','https://www.zazerkal.spb.ru/images/data/repertoire/520_small_1762600258.jpeg','==В ролях:==\n\'\'СОСТАВ УТОЧНЯЕТСЯ\'\'\n\n\'\'\'[http://www.zazerkal.spb.ru/tickets/1701.htm|КУПИТЬ БИЛЕТ]\'\'\'',0,65,'Планета3',12,2025,'2025-11-08 17:25:21','2025-11-08 17:26:03','Новый_год_на_планете_№_3_28.12.25_11'),
(98,'2836c152-ebd2-44f2-8314-11f01575a577','2025-12-28','16:00:00','Новый год на планете № 3','новый год на планете 3','Для всей семьи','1707','https://www.zazerkal.spb.ru/tickets/1707.htm','https://www.zazerkal.spb.ru/repertoire/product520.htm','https://www.zazerkal.spb.ru/images/data/repertoire/520_small_1762600258.jpeg','==В ролях:==\n\'\'СОСТАВ УТОЧНЯЕТСЯ\'\'\n\n\'\'\'[http://www.zazerkal.spb.ru/tickets/1707.htm|КУПИТЬ БИЛЕТ]\'\'\'',0,65,'Планета3',12,2025,'2025-11-08 17:25:21','2025-11-08 17:26:03','Новый_год_на_планете_№_3_28.12.25_16'),
(99,'2836c152-ebd2-44f2-8314-11f01575a577','2025-12-28','18:00:00','Маша у гномов на ёлке','маша у гномов на елке','Для всей семьи','1719','https://www.zazerkal.spb.ru/tickets/1719.htm','https://www.zazerkal.spb.ru/repertoire/product521.htm','https://www.zazerkal.spb.ru/images/data/repertoire/521_small_1762600286.jpeg','==В ролях:==\n\'\'СОСТАВ УТОЧНЯЕТСЯ\'\'\n\n\'\'\'[http://www.zazerkal.spb.ru/tickets/1719.htm|КУПИТЬ БИЛЕТ]\'\'\'',0,64,'Гномы',12,2025,'2025-11-08 17:25:21','2025-11-08 17:26:03','Маша_у_гномов_на_ёлке_28.12.25'),
(100,'2836c152-ebd2-44f2-8314-11f01575a577','2025-12-29','11:00:00','Новый год на планете № 3','новый год на планете 3','Для всей семьи','1702','https://www.zazerkal.spb.ru/tickets/1702.htm','https://www.zazerkal.spb.ru/repertoire/product520.htm','https://www.zazerkal.spb.ru/images/data/repertoire/520_small_1762600258.jpeg','==В ролях:==\n\'\'СОСТАВ УТОЧНЯЕТСЯ\'\'\n\n\'\'\'[http://www.zazerkal.spb.ru/tickets/1702.htm|КУПИТЬ БИЛЕТ]\'\'\'',0,65,'Планета3',12,2025,'2025-11-08 17:25:21','2025-11-08 17:26:03','Новый_год_на_планете_№_3_29.12.25'),
(101,'2836c152-ebd2-44f2-8314-11f01575a577','2025-12-29','13:30:00','Маша у гномов на ёлке','маша у гномов на елке','Для всей семьи','1725','https://www.zazerkal.spb.ru/tickets/1725.htm','https://www.zazerkal.spb.ru/repertoire/product521.htm','https://www.zazerkal.spb.ru/images/data/repertoire/521_small_1762600286.jpeg','==В ролях:==\n\'\'СОСТАВ УТОЧНЯЕТСЯ\'\'\n\n\'\'\'[http://www.zazerkal.spb.ru/tickets/1725.htm|КУПИТЬ БИЛЕТ]\'\'\'',0,64,'Гномы',12,2025,'2025-11-08 17:25:21','2025-11-08 17:26:03','Маша_у_гномов_на_ёлке_29.12.25'),
(102,'2836c152-ebd2-44f2-8314-11f01575a577','2025-12-30','11:00:00','Новый год на планете № 3','новый год на планете 3','Для всей семьи','1706','https://www.zazerkal.spb.ru/tickets/1706.htm','https://www.zazerkal.spb.ru/repertoire/product520.htm','https://www.zazerkal.spb.ru/images/data/repertoire/520_small_1762600258.jpeg','==В ролях:==\n\'\'СОСТАВ УТОЧНЯЕТСЯ\'\'\n\n\'\'\'[http://www.zazerkal.spb.ru/tickets/1706.htm|КУПИТЬ БИЛЕТ]\'\'\'',0,65,'Планета3',12,2025,'2025-11-08 17:25:21','2025-11-08 17:26:03','Новый_год_на_планете_№_3_30.12.25'),
(103,'2836c152-ebd2-44f2-8314-11f01575a577','2025-12-30','13:30:00','Маша у гномов на ёлке','маша у гномов на елке','Для всей семьи','1721','https://www.zazerkal.spb.ru/tickets/1721.htm','https://www.zazerkal.spb.ru/repertoire/product521.htm','https://www.zazerkal.spb.ru/images/data/repertoire/521_small_1762600286.jpeg','==В ролях:==\n\'\'СОСТАВ УТОЧНЯЕТСЯ\'\'\n\n\'\'\'[http://www.zazerkal.spb.ru/tickets/1721.htm|КУПИТЬ БИЛЕТ]\'\'\'',0,64,'Гномы',12,2025,'2025-11-08 17:25:21','2025-11-08 17:26:03','Маша_у_гномов_на_ёлке_30.12.25_1330'),
(104,'2836c152-ebd2-44f2-8314-11f01575a577','2025-12-30','16:00:00','Маша у гномов на ёлке','маша у гномов на елке','Для всей семьи','1722','https://www.zazerkal.spb.ru/tickets/1722.htm','https://www.zazerkal.spb.ru/repertoire/product521.htm','https://www.zazerkal.spb.ru/images/data/repertoire/521_small_1762600286.jpeg','==В ролях:==\n\'\'СОСТАВ УТОЧНЯЕТСЯ\'\'\n\n\'\'\'[http://www.zazerkal.spb.ru/tickets/1722.htm|КУПИТЬ БИЛЕТ]\'\'\'',0,64,'Гномы',12,2025,'2025-11-08 17:25:21','2025-11-08 17:26:03','Маша_у_гномов_на_ёлке_30.12.25_16'),
(105,'2836c152-ebd2-44f2-8314-11f01575a577','2025-12-31','18:00:00','Новогодний музыкальный фейерверк','новогодний музыкальный фейерверк','Для всей семьи','1690','https://www.zazerkal.spb.ru/tickets/1690.htm','https://www.zazerkal.spb.ru/repertoire/product281.htm','https://www.zazerkal.spb.ru/images/data/repertoire/281_small_1637158262.jpg','==В ролях:==\n\'\'СОСТАВ УТОЧНЯЕТСЯ\'\'\n\n\'\'\'[http://www.zazerkal.spb.ru/tickets/1690.htm|КУПИТЬ БИЛЕТ]\'\'\'',0,36,'Фейерверк',12,2025,'2025-11-08 17:25:21','2025-11-08 17:26:03','Новогодний_музыкальный_фейерверк_31.12.25'),
(106,'f5853d8d-1392-4a85-9ac0-631f6b2c742d','2026-01-02','11:00:00','Маша у гномов на ёлке','маша у гномов на елке','Для всей семьи','1729','https://www.zazerkal.spb.ru/tickets/1729.htm','https://www.zazerkal.spb.ru/repertoire/product521.htm','https://www.zazerkal.spb.ru/images/data/repertoire/521_small_1762600286.jpeg','==В ролях:==\n\'\'СОСТАВ УТОЧНЯЕТСЯ\'\'\n\n\'\'\'[http://www.zazerkal.spb.ru/tickets/1729.htm|КУПИТЬ БИЛЕТ]\'\'\'',0,64,'Гномы',1,2026,'2025-11-08 17:30:06','2025-11-08 17:30:22','Маша_у_гномов_на_ёлке_02.01.26'),
(107,'f5853d8d-1392-4a85-9ac0-631f6b2c742d','2026-01-02','13:30:00','Новый год на планете № 3','новый год на планете 3','Для всей семьи','1705','https://www.zazerkal.spb.ru/tickets/1705.htm','https://www.zazerkal.spb.ru/repertoire/product520.htm','https://www.zazerkal.spb.ru/images/data/repertoire/520_small_1762600258.jpeg','==В ролях:==\n\'\'СОСТАВ УТОЧНЯЕТСЯ\'\'\n\n\'\'\'[http://www.zazerkal.spb.ru/tickets/1705.htm|КУПИТЬ БИЛЕТ]\'\'\'',0,65,'Планета3',1,2026,'2025-11-08 17:30:06','2025-11-08 17:30:22','Новый_год_на_планете_№_3_02.01.26_1330'),
(108,'f5853d8d-1392-4a85-9ac0-631f6b2c742d','2026-01-02','16:00:00','Новый год на планете № 3','новый год на планете 3','Для всей семьи','1711','https://www.zazerkal.spb.ru/tickets/1711.htm','https://www.zazerkal.spb.ru/repertoire/product520.htm','https://www.zazerkal.spb.ru/images/data/repertoire/520_small_1762600258.jpeg','==В ролях:==\n\'\'СОСТАВ УТОЧНЯЕТСЯ\'\'\n\n\'\'\'[http://www.zazerkal.spb.ru/tickets/1711.htm|КУПИТЬ БИЛЕТ]\'\'\'',0,65,'Планета3',1,2026,'2025-11-08 17:30:06','2025-11-08 17:30:22','Новый_год_на_планете_№_3_02.01.26_16'),
(109,'f5853d8d-1392-4a85-9ac0-631f6b2c742d','2026-01-03','13:30:00','Новый год на планете № 3','новый год на планете 3','Для всей семьи','1713','https://www.zazerkal.spb.ru/tickets/1713.htm','https://www.zazerkal.spb.ru/repertoire/product520.htm','https://www.zazerkal.spb.ru/images/data/repertoire/520_small_1762600258.jpeg','==В ролях:==\n\'\'СОСТАВ УТОЧНЯЕТСЯ\'\'\n\n\'\'\'[http://www.zazerkal.spb.ru/tickets/1713.htm|КУПИТЬ БИЛЕТ]\'\'\'',0,65,'Планета3',1,2026,'2025-11-08 17:30:06','2025-11-08 17:30:22','Новый_год_на_планете_№_3_03.01.26_1330'),
(110,'f5853d8d-1392-4a85-9ac0-631f6b2c742d','2026-01-03','16:00:00','Новый год на планете № 3','новый год на планете 3','Для всей семьи','1710','https://www.zazerkal.spb.ru/tickets/1710.htm','https://www.zazerkal.spb.ru/repertoire/product520.htm','https://www.zazerkal.spb.ru/images/data/repertoire/520_small_1762600258.jpeg','==В ролях:==\n\'\'СОСТАВ УТОЧНЯЕТСЯ\'\'\n\n\'\'\'[http://www.zazerkal.spb.ru/tickets/1710.htm|КУПИТЬ БИЛЕТ]\'\'\'',0,65,'Планета3',1,2026,'2025-11-08 17:30:06','2025-11-08 17:30:22','Новый_год_на_планете_№_3_03.01.26_16'),
(111,'f5853d8d-1392-4a85-9ac0-631f6b2c742d','2026-01-04','11:00:00','Маша у гномов на ёлке','маша у гномов на елке','Для всей семьи','1730','https://www.zazerkal.spb.ru/tickets/1730.htm','https://www.zazerkal.spb.ru/repertoire/product521.htm','https://www.zazerkal.spb.ru/images/data/repertoire/521_small_1762600286.jpeg','==В ролях:==\n\'\'СОСТАВ УТОЧНЯЕТСЯ\'\'\n\n\'\'\'[http://www.zazerkal.spb.ru/tickets/1730.htm|КУПИТЬ БИЛЕТ]\'\'\'',0,64,'Гномы',1,2026,'2025-11-08 17:30:06','2025-11-08 17:30:22','Маша_у_гномов_на_ёлке_04.01.26'),
(112,'f5853d8d-1392-4a85-9ac0-631f6b2c742d','2026-01-04','13:30:00','Новый год на планете № 3','новый год на планете 3','Для всей семьи','1704','https://www.zazerkal.spb.ru/tickets/1704.htm','https://www.zazerkal.spb.ru/repertoire/product520.htm','https://www.zazerkal.spb.ru/images/data/repertoire/520_small_1762600258.jpeg','==В ролях:==\n\'\'СОСТАВ УТОЧНЯЕТСЯ\'\'\n\n\'\'\'[http://www.zazerkal.spb.ru/tickets/1704.htm|КУПИТЬ БИЛЕТ]\'\'\'',0,65,'Планета3',1,2026,'2025-11-08 17:30:06','2025-11-08 17:30:22','Новый_год_на_планете_№_3_04.01.26_1330'),
(113,'f5853d8d-1392-4a85-9ac0-631f6b2c742d','2026-01-04','16:00:00','Новый год на планете № 3','новый год на планете 3','Для всей семьи','1712','https://www.zazerkal.spb.ru/tickets/1712.htm','https://www.zazerkal.spb.ru/repertoire/product520.htm','https://www.zazerkal.spb.ru/images/data/repertoire/520_small_1762600258.jpeg','==В ролях:==\n\'\'СОСТАВ УТОЧНЯЕТСЯ\'\'\n\n\'\'\'[http://www.zazerkal.spb.ru/tickets/1712.htm|КУПИТЬ БИЛЕТ]\'\'\'',0,65,'Планета3',1,2026,'2025-11-08 17:30:06','2025-11-08 17:30:22','Новый_год_на_планете_№_3_04.01.26_16'),
(114,'f5853d8d-1392-4a85-9ac0-631f6b2c742d','2026-01-05','11:00:00','Маша у гномов на ёлке','маша у гномов на елке','Для всей семьи','1720','https://www.zazerkal.spb.ru/tickets/1720.htm','https://www.zazerkal.spb.ru/repertoire/product521.htm','https://www.zazerkal.spb.ru/images/data/repertoire/521_small_1762600286.jpeg','==В ролях:==\n\'\'СОСТАВ УТОЧНЯЕТСЯ\'\'\n\n\'\'\'[http://www.zazerkal.spb.ru/tickets/1720.htm|КУПИТЬ БИЛЕТ]\'\'\'',0,64,'Гномы',1,2026,'2025-11-08 17:30:06','2025-11-08 17:30:22','Маша_у_гномов_на_ёлке_05.01.26'),
(115,'f5853d8d-1392-4a85-9ac0-631f6b2c742d','2026-01-05','16:00:00','Новый год на планете № 3','новый год на планете 3','Для всей семьи','1703','https://www.zazerkal.spb.ru/tickets/1703.htm','https://www.zazerkal.spb.ru/repertoire/product520.htm','https://www.zazerkal.spb.ru/images/data/repertoire/520_small_1762600258.jpeg','==В ролях:==\n\'\'СОСТАВ УТОЧНЯЕТСЯ\'\'\n\n\'\'\'[http://www.zazerkal.spb.ru/tickets/1703.htm|КУПИТЬ БИЛЕТ]\'\'\'',0,65,'Планета3',1,2026,'2025-11-08 17:30:06','2025-11-08 17:30:22','Новый_год_на_планете_№_3_05.01.26'),
(116,'f5853d8d-1392-4a85-9ac0-631f6b2c742d','2026-01-06','12:00:00','Маша у гномов на ёлке','маша у гномов на елке','Для всей семьи','1728','https://www.zazerkal.spb.ru/tickets/1728.htm','https://www.zazerkal.spb.ru/repertoire/product521.htm','https://www.zazerkal.spb.ru/images/data/repertoire/521_small_1762600286.jpeg','==В ролях:==\n\'\'СОСТАВ УТОЧНЯЕТСЯ\'\'\n\n\'\'\'[http://www.zazerkal.spb.ru/tickets/1728.htm|КУПИТЬ БИЛЕТ]\'\'\'',0,64,'Гномы',1,2026,'2025-11-08 17:30:06','2025-11-08 17:30:22','Маша_у_гномов_на_ёлке_06.01.26'),
(117,'f5853d8d-1392-4a85-9ac0-631f6b2c742d','2026-01-06','15:00:00','Синяя птица','синяя птица','Для всей семьи','1698','https://www.zazerkal.spb.ru/tickets/1698.htm','https://www.zazerkal.spb.ru/repertoire/product328.htm','https://www.zazerkal.spb.ru/images/data/repertoire/328_small_1733326862.jpg','==В ролях:==\n\'\'СОСТАВ УТОЧНЯЕТСЯ\'\'\n\n\'\'\'[http://www.zazerkal.spb.ru/tickets/1698.htm|КУПИТЬ БИЛЕТ]\'\'\'',0,4,'СП',1,2026,'2025-11-08 17:30:06','2025-11-08 17:30:22','Синяя_птица_06.01.26_15'),
(118,'f5853d8d-1392-4a85-9ac0-631f6b2c742d','2026-01-06','19:00:00','Синяя птица','синяя птица','Для всей семьи','1700','https://www.zazerkal.spb.ru/tickets/1700.htm','https://www.zazerkal.spb.ru/repertoire/product328.htm','https://www.zazerkal.spb.ru/images/data/repertoire/328_small_1733326862.jpg','==В ролях:==\n\'\'СОСТАВ УТОЧНЯЕТСЯ\'\'\n\n\'\'\'[http://www.zazerkal.spb.ru/tickets/1700.htm|КУПИТЬ БИЛЕТ]\'\'\'',0,4,'СП',1,2026,'2025-11-08 17:30:06','2025-11-08 17:30:22','Синяя_птица_06.01.26_19'),
